product_name,review,cleaned_review
[이나연pick] VT 피디알엔 에센스 100 30ml 더블 기획 (+리들샷 100 10ml),"속광이 잘 느껴지고 쫀쫀하게 해줘서 사용하기가 좋아요. 흡수력도 좋습니다 몇번째 재구매인지 모르겠어요! 이거 진짜 넘넘 좋아요!! 이것만 바르면 진짜 피부가 반들반들 완전 꿀광..물광.. 광이란 광은 다 표현되는 거 같아요 제형 너무 오일리하지는 않은데 바르면 영양감도 있고 쫀쫀해지는 기분이라 좋아하는 제품이예요 기울어지거나 눕혀지면 살짝새서 조금 불편했는데 사용감은 만족스러웠어요 이렇게 펌핑용기로 되어있어요. 사이즈도 컴팩트
하고 가벼운 편이라 여행용으로 가져가도 괜찮겠
더라구요.요즘 모공이 자꾸 넓어지는 것 같아서그 점도고민이었는데 리들샷 효과도 볼수 있다고 하니 앞으로도 꾸준히 써봐야겠어요. Pdrn이 건조한 피부이 좋다해서 써봤는데 너무 좋아요ㅜ 언니가 추천해줘서 한번 써보고 반해버린 에센스예요~ 진짜 거짓말아니고 물광이 나서 이거 바르고 그위에 선크림만 바르고 나갔는데 동네 엄마들 피부과 갔다왔냐며 피부에서 빛이 난다고~~ 진짜로요!!

올리브영 행사할때 사니 가격도 대박입니다~ 무조건 재구매각입니다. 한줄 요약티존은 번들거림 안 올라오고 건조한 볼은 속건조 잡혀서 복합성분들에게 잘맞는 PDRN에센스장점제형이 산뜻하게 가벼워서 티존에 발라도 번들거림이 거의 없습니다티존은 지성,나머지는 모두 건성인데 건조한 부분은 한달 쓰니까 속건조가 줄고 화장 뜨는 게 확실히 덜했어요 화장전에 가볍게 발라 줬습니다유분기 적은 속광느낌으로 연출돼서 개기름 말고 피부 좋아 보이는 광 갖고싶으시다?이 아이 데려가십쇼자극 없어서 트러블 올라온 날도 부담 없이 사용 가능합니다흡수 빨라서 아침에 써도 괜찮았어요꾸준히 쓰면 피부결 정돈+전체 컨디션 안정되는 느낌?!펌프형 눌러서 쓰는 타입이라 양조절하기는 쉬워요기획세트라 가성비 체감 괜찮습니다 열분들은 기획세트 세일 많이 하실 때 사세용 같은 PDRN라인 3종이랑 써주면 시너지효과☆단점볼 쪽이 많이 건조한 날엔 이것만 쓰면 보습 부족해요티존에 과하게 바르면 기름기? 올라오는 느낌ㅠㅠ즉각적으로 효과는 안나타나고 꾸준히 계속 써줘야 효과 보여요탄력 변화는 거의 못봤어요~정리~복합성 기준으로 데일리 에센스로 쓰기 진짜 무난한 편볼은 보습크림 살짝 얹고, 티존은 얇게 바르는 게 제일 좋았음꾸준히 써야 효과 나타남

제 리뷰가 도움이 되셨다면 좋아요 버튼👍 부탁드려요😍😍",자다 느껴지다 쫀쫀하 해주다 사용 좋다 흡수 좋다 몇번 구매 모르다 진짜 넘다 넘다 좋다 바르다 진짜 피부 꿀광 물광 표현 일리 바르다 양감 쫀쫀해 기분 좋아하다 제품 기울어지다 눕다 살짝 새다 불편하다 용감 만족스럽다 펌핑용기 되어다 사이즈 컴팩트 가볍다 여행 가져가다 괜찮다 모공 자꾸 넓어지다 점도 고민 리들샷 효과 하니 꾸준하다 써다 건조하다 피부 좋다 다해 써다 좋다 언니 추천 해주다 써다 반하다 버리다 에센스 진짜 거짓말 물광 나서다 바르다 선크림 바르다 나가다 동네 엄마 피부 가다 오다 피부 나다 진짜 올리브영 행사 살다 가격 대박 무조건 재다 매각 티존 들다 올라오다 건조하다 건조 잡히다 복합 성분 잘맞다 에센스 장점 산뜻하다 가볍다 티존 발라 들다 티존 지성 나머지 건성 건조하다 부분 쓰다 건조 화장 뜨다 확실하다 덜하다 화장 가볍다 발라 주다 분기 적다 느낌 연출 돼다 기름 피부 좋다 보이다 갖다 데려가다 자극 트러블 올라오다 부담 사용 가능하다 흡수 아침 써다 괜찮다 꾸준하다 쓰다 피부 정돈 전체 컨디션 안정 느낌 펌프 누르다 쓰다 타입 조절 쉽다 기획 세트 가성 체감 괜찮다 기획 세트 세용 라인 종이 써주다 시너지 효과 단점 건조하다 쓰다 보습 부족하다 티존 바르다 기름기 올라오다 느낌 즉각 효과 나타나다 꾸준하다 계속 써주다 효과 보이다 탄력 변화 정리 복합 기준 일리 에센스 쓰기 진짜 무난 편볼 보습 크림 살짝 얹다 티존 얇다 바르다 제일 좋다 꾸준하다 써다 효과 나타남 리뷰 도움 좋다 버튼 부탁드리다
[자타입/단독기획] 닥터지 레드블레미쉬 클리어 수딩크림 EX 70ml 기획 (+30ml+세럼10ml*2ea),"수딩크림을 자주 사용하지 않았는데 피부의 건조함을 이기지 못하고 사용을 시작했습니다.
꾸준히 사용해야 효과를 볼 수 있는데 양도 넉넉하고 또 발림성도 좋고, 끈적임이 없어서 꾸준히 사용가능하겠더라구요.
남성용이 따로 있어서 구매에 참고하세요? 피부가 예민하고 붉어질 때 사용했는데 자극 없이 편안하게 진정되는 느낌이 좋았습니다. 젤크림 제형이라 가볍게 발리면서도 수분감은 충분했어요.

흡수 후 끈적임이 거의 없어 아침, 저녁 모두 사용하기 좋았고 피부 컨디션이 불안정할 때 특히 만족도가 높았습니다. 계절이 바뀌면서 유수분 밸런스가 무너지고 붉은 트러블과 열감 때문에 고생하는 예민한 장벽의 지인에게 선물했습니다. 믿고 쓰는 닥터지 정품이라 받는 사람도 무척 안심하고 좋아하더라고요. 끈적임 없이 산뜻하고 촉촉하게 스며드는 젤 텍스처라 듬뿍 얹어도 답답함이 전혀 없다고 해요. 한 달 동안 아침저녁으로 꼼꼼히 발라주었더니 화끈거리던 살결이 편안하게 진정되고 속당김까지 말끔하게 해결되었다며 감사의 인사를 전해왔습니다. 수분감이 풍부하면서도 끈적임이 적어 사계절 사용하기 좋은 수딩크림입니다. 피부가 예민해졌을 때 사용하면 열감과 붉은기가 완화되는 느낌을 받았습니다. 대용량 기획 구성이라 넉넉하게 사용할 수 있어 더욱 만족스러웠습니다. 피부 예민한 저의 정착템 ( 3번째 구매 ) ♥

친한 언니 집 가서 써보고 너무 좋아서 바로 정보 알려달라고 했어요 !!

제가 스트레스 받으면 바로 각질이 올라오는 사람이고 피부가 너무 예민해서 안맞는 거 쓰면 바로 따가운 게 느껴지는데 너무 순해서 그런 느낌이 없습니다 ㅜㅜ

진짜 제가 토너, 크림 정착하기 정말 힘든 피부인데 토너, 크림 둘 다 닥터지꺼 쓰고 있어요 ♥

이번에 꼭 한달 리뷰 달러올게요 닥터지 순해서 예민한 피부에 좋아요~

다쓰고 재구매할게요 닥터지 크림은 정말 꾸준하게 구매해서 사용하고 있어요.
지성 피부에 여드름도 안나고 성분이 순해서 너무 좋습니다. 이거써보니
전 저녁에 바르고 자봤는데
다음날 아침에 폼클렌징으로 세수하려고 했더니
그때까지 피부가 매끈매끈 쵹쵹쓰한거 있죠?
수분 지속시간이 200시간이라니,,
못믿었는데 일단 7시간 정도 되었을때는 매우 쵹쵹쓰해서
제 피부를 폼클렌징으로 갈아엎기 아까울 정도랍니다
자극도 없어요
민감성이신분들?
피부 사막이신분들?
매끈피부 원하는분들?
한마디만 합니다
사세요.",크림 자주 사용 피부 건조하다 이기 사용 시작 꾸준하다 사용 효과 양도 넉넉하다 발림 성도 좋다 적임 꾸준하다 사용 가능하다 남성 용이 구매 참고 피부 예민하다 붉다 사용 자극 편안하다 진정 느낌 좋다 크림 가볍다 발리다 수분 감다 충분하다 흡수 적임 아침 저녁 사용 좋다 피부 컨디션 불안정하다 만족도 높다 계절 바뀌다 유수 밸런스 무너지다 붉다 트러블 고생 예민하다 장벽 지인 선물 믿다 쓰다 닥터 정품 받다 무척 안심 좋아하다 적임 산뜻하다 촉촉하다 스며들다 텍스처 듬뿍 얹다 답답하다 전혀 아침 저녁 꼼꼼하다 바르다 화끈 거리 살결 편안하다 진정 해결 되어다 감사 인사 해오다 수분 풍부하다 적임 적다 사계절 사용 좋다 크림 피부 예민하다 사용 붉다 은기 완화 느낌 받다 용량 기획 구성 넉넉하다 사용 더욱 만족스럽다 피부 예민하다 정착 구매 친하다 언니 가다 써다 좋다 정보 알다 달라 스트레스 받다 각질 올라오다 피부 예민하다 맞다 쓰다 따갑다 느껴지다 순하다 느낌 진짜 토너 크림 정착 힘드다 피부 토너 크림 닥터 끄다 쓰다 리뷰 달러 오다 닥터 순하다 예민하다 피부 좋다 쓰다 재다 닥터 크림 꾸준하다 구매 사용 지성 피부 여드름 안나 성분 순하다 좋다 써다 저녁 바르다 아침 폼클렌징 세수 피부 쵹쵹쓰한거 수분 믿다 정도 되어다 쵹쵹쓰해 피부 폼클렌징 갈아엎다 아깝다 정도 자극 민감 이신 피부 사막 이신 피부 원하다 사다
[잡티미백] 구달 청귤 비타C 잡티케어 세럼 알파 30ml 기획 (+20ml),"구달 청귤 비타C 잡티케어 세럼 알파 30ml 기획이라 좋아요 구달 청귤 비타C 세럼은 벌써 몇 병째 비우고 있는 저의 찐 N통템이에요! 피부에 자극적이지 않은 저자극 제품이라 매일 아침저녁으로 부담 없이 바르기 좋은 데일리세럼입니다. 촉촉하고 가벼운 제형이라 겉돌지 않고 피부에 쏙 흡수돼서 사용감이 정말 편해요. 나이아신아마이드 성분이 들어있어서 그런지 꾸준히 쓰다 보면 확실히 칙칙했던 피부 톤이 전체적으로 맑아지고 흔적들도 옅어지는 게 눈으로 보여요. 괜히 1등 잡티세럼으로 유명한 게 아니네요. 앞으로도 계속 정착할 예정입니다! 완전 강추해요. 기미 잡티가 고민인 사람이라 여러가지 미백 제품 써보고 있는데요.올리브영 1등 잡티 세럼이라고 해서 구입해 보았습니다.탱글한 젤타입 세럼으로 흘러내리지 않고 끈적임 없이 스며들어서 요즘 같이 더운 계절에도 사용하기 좋은 것 같네요. 소량만 사용해줘도 굉장히 촉촉함이 느껴지고 무거운 느낌이 없어서 데일리하게 사용하기 좋은 것 같아요. 구달 청귤 비타C 잡티케어 세럼은 워낙 유명해서 기대하고 써봤는데, 왜 꾸준히 베스트셀러인지 알겠더라고요.

처음 바를 때는 묽고 산뜻한 제형이라 끈적임이 거의 없고 흡수가 빠른 편이에요. 비타민C 세럼이라고 하면 따갑거나 자극적일 거라고 생각했는데, 이 제품은 민감한 날에도 부담 없이 사용할 수 있을 정도로 순하게 느껴졌어요. 청귤 특유의 상큼한 향도 기분 좋고요.

저는 트러블이 지나간 뒤 남은 자국과 칙칙한 피부톤 때문에 사용하기 시작했는데, 며칠 만에 드라마틱하게 사라진다기보다는 피부가 전체적으로 맑고 균일해 보이는 느낌이 들었습니다. 특히 아침에 사용하면 피부가 한층 화사해 보여서 메이크업할 때도 만족도가 높았어요.

가장 마음에 들었던 건 수분감이었습니다. 비타민 세럼인데도 건조하거나 당기는 느낌이 없고 촉촉하게 마무리돼서 여름에는 단독으로, 건조한 계절에는 크림과 함께 사용하기 좋았습니다.

잡티, 트러블 흔적, 칙칙한 피부톤이 고민이라면 한 병쯤은 꼭 써볼 만한 국민 잡티세럼. ""피부가 좋아졌다""보다 ""피부가 맑아 보인다""는 말을 듣고 싶은 사람에게 특히 추천하고 싶어요.

한 줄 후기

""거울 볼 때마다 보이던 잡티가 고민이었다면, 왜 다들 청귤세럼 청귤세럼 하는지 직접 알게 되는 제품."" 요즘 햇빛이 강해서 그런지 유독 잡티가 많이 생기는 것 같아서 잡티세럼을 찾던 중 평이 좋아 구매해봤는데 일단 발림성이 시원촉촉하여 더운날 달아오른 피부 진정효과부터 맘에 들었어요. 그렇지만 잡티개선 효과가 관건인건데 잡티에 작용해서 옅어지게 하는지 까지는 모르겠으나 피부가 점차 환해지고 투명해지는 효과와 함께 화장이 잘 먹으니까 잡티세럼으로 추천할만한 선택이랄까. 순해서 붉어지거나 뾰루지 유발같은 자극 걱정 안해도 되고 보습감과 수분유지력도 합격점인데 다만 바른 직후 끈적임이 남는게 아쉬워요. 그래서 세럼 바르고나서 솜에 스킨 적셔서 패팅을 해주는 방식으로 끈적임을 줄여주곤 합니다. 올여름 이 세럼으로 기초 해결! 잡티 케어용으로 꾸준히 사용 중인데, 끈적임 없이 산뜻하게 흡수돼서 아침저녁으로 바르기 좋았어요. 촉촉하게 발리면서 피부가 한층 맑아 보이는 느낌이 들어 만족스럽더라고요. 미니어처까지 함께 들어 있어 여행이나 휴대용으로 활용하기도 편한 제품이에요.",구달 청귤 비타 티케 알파 기획 좋다 구달 청귤 비타 벌써 비우다 찌다 통템 피부 자극 자극 제품 매일 아침 저녁 부담 바르다 좋다 데일 리세 촉촉하다 가볍다 돌다 피부 흡수 돼다 용감 편하다 나이아신 아마이드 성분 들다 꾸준하다 쓰다 확실하다 칙칙하다 피부 전체 맑다 흔적 옅다 보이다 잡티세럼 유명하다 계속 정착 예정 추하다 기미 잡티 고민 여러가지 미백 제품 써다 올리브영 잡티 구입 타입 흘러내리다 적임 스며들다 덥다 계절 사용 좋다 소량 사용 해주다 굉장하다 촉촉하다 느껴지다 무겁다 느낌 데일 리하 사용 좋다 구달 청귤 비타 티케 워낙 유명하다 기대하다 써다 꾸준하다 베스트셀러 알다 처음 바르다 묽다 산뜻하다 적임 흡수 빠르다 비타민 따갑다 자극 제품 민감하다 부담 사용 정도 순하다 느껴지다 청귤 상큼 기분 좋다 트러블 지나가다 남다 자국 칙칙하다 피부 사용 시작 며칠 드라마틱하다 사라지다 다기 피부 전체 맑다 균일하다 보이다 느낌 들다 아침 사용 피부 한층 화사하다 메이크업 만족도 높다 마음 들다 수분 가다 비타민 건조하다 당기다 느낌 촉촉하다 마무리 돼다 여름 단독 건조하다 계절 크림 사용 좋다 잡티 트러블 흔적 칙칙하다 피부 고민 라면 써다 국민 잡티세럼 피부 좋아지다 피부 맑다 보이다 늘다 듣다 싶다 추천 싶다 후기 거울 잡티 고민 들다 청귤 청귤 직접 제품 햇빛 강하다 유독 잡티 생기다 잡티세럼 찾다 평이 좋다 구매 해봤다 발림 시원 촉촉하다 덥다 달아오르다 피부 진정 효과 들다 잡티 개선 효과 관건 잡티 작용 옅다 모르다 피부 점차 환하다 투명하다 효과 화장 자다 먹다 잡티세럼 추천 선택 끄다 순하다 붉다 뾰루 유발 자극 걱정 안해 보습 수분 유지 합격 바르다 직후 적임 남다 아쉽다 바르다 스킨 적다 패팅 해주다 방식 적임 줄이다 올여름 기초 해결 잡티 케어 꾸준하다 사용 적임 산뜻하다 흡수 돼다 아침 저녁 바르다 좋다 촉촉하다 발리다 피부 한층 맑다 보이다 느낌 들다 만족스럽다 미니어처 들다 여행 휴대 활용 편하다 제품
[장벽미스트/+50ml증정 기획]유이크 바이옴 베리어 크림 미스트 100ml 기획 (+50ml),"무겁거나 끈적거리지 않고 촉촉해서ㅓ 겨울내내 잘 썼어요 ! 촉촉하고 많이 기름지지 않아서 겨울에 ㅔ특히 잘 썼어요 !! 크림미스트인데 무겁고 끈적거리지않고 촉촉해서 잘 씁니당 진짜 좋아요.. 진심 이거 스킨대용 미스트 중에 젤 좋은 거 같아요.. 제대로 수분감도 채워주고 좋아요,, 아주 추천!!!! 건성한테 최고의 미스트입니다.
몇통썼는지 기억도안남 최소 열통이에요.
올리브영 팔기도전부터 썼습니다.
웬만한 미스트로 보습 안 채워진다 하면 이거에요.
건성이라 덕지덕지 보습수분채워진거 다 바르고도 이거 두세번 뿌리고 잘정도에요. 유이크 바이옴 베리어 크림 미스트를 한 달 정도 꾸준히 사용해봤는데, 가장 만족스러웠던 점은 건조할 때마다 간편하게 수분을 채워줄 수 있다는 점이었어요. 미세한 분사력 덕분에 메이크업 위에도 부담 없이 사용할 수 있었습니다.

사용 초반에는 단순히 촉촉한 미스트라고 생각했는데, 꾸준히 사용하다 보니 피부가 쉽게 건조해지지 않고 피부 장벽이 한층 편안해진 느낌이 들었어요. 특히 세안 후나 피부가 예민한 날 사용하면 피부 당김이 덜해서 만족스러웠습니다.

크림과 미스트의 장점을 함께 담은 제품이라 그런지 수분감이 오래 유지되는 편이었고, 끈적임 없이 산뜻하게 마무리돼 사계절 내내 사용하기 좋을 것 같아요. 외출 시에도 휴대하면서 수시로 뿌려주기 편했습니다.

한 달 동안 사용해본 결과, 단순한 수분 공급뿐 아니라 피부 컨디션 관리에도 도움이 되는 느낌이라 재구매 의사가 있는 제품입니다. 건조함과 피부 장벽 케어가 고민인 분들께 추천하고 싶어요.",무겁다 거리 촉촉하다 겨울 내내 자다 써다 촉촉하다 기름 지지 겨울 자다 써다 크림 미스트 무겁다 거리 촉촉하다 자다 쓰다 진짜 좋다 진심 스킨 대용 미스트 좋다 수분 감다 채우다 좋다 추천 건성 최고 미스 트이다 써다 기억 안남 최소 올리브영 도전 써다 웬만하다 미스트 보습 채우다 건성 덕지덕지 보습 수분 채우다 바르다 세번 뿌리 자다 정도 이크 바이옴 베리 크림 미스트 정도 꾸준하다 사용 해봤다 만족스럽다 건조하다 간편하다 수분 채우다 미세하다 분사 덕분 메이크업 부담 사용 사용 초반 단순하다 촉촉하다 미스트 꾸준하다 사용 피부 쉬다 건조하다 피부 장벽 한층 편안하다 느낌 들다 세안 피부 예민하다 사용 피부 당기다 덜하다 만족스럽다 크림 미스트 장점 담다 제품 수분 유지 펴다 적임 산뜻하다 마무리 돼다 사계절 내내 사용 좋다 외출 휴대 뿌리다 편하다 사용 해보다 결과 단순하다 수분 공급 피부 컨디션 관리 도움 느낌 재다 의사 제품 건조하다 피부 장벽 케어 고민 추천 싶다
[장원영PICK] 닥터엘시아 345 릴리프 크림 50ml,"케이스가 조금 아쉬워요,,, 그냥 플라스틱 튜브타입이면 더 좋을텐데 여름에도 항상 꾸덕한크림바르는 사람이에요
근데 낮에는 너무더워서 땀송글송글 맺혀서 이걸 사봤는데 만족해요
꾸덕함은 없는데 바르고 땡김없고 속채워쥬는느낌?!
화장밀림없고요 촉촉해요 건조하지않아요 건성에게 추천
여름에 바를 크림 찾은거같아요ㅜㅜ 좋아요 처음엔 그냥 무난하고 순한 발림성 좋은 크림이라고 생각햇는데 바르면 피부가 확실히 편안하고 하나도 안 무거워서 조아요 지인이 추천해줘서 구매해봤어요 발lim성 좋아서 무난템이에요 자극없고 순하긴한데, 악건성이 사용하기에는 보습 유지력이 약함, 그냥 지복합성이 가볍게 데일리로 사용하기 좋은 흔적 효과에 좋은 크림. 근데 용기는 진짜 일반 튜브형으로 바꼈으면 좋겠습니다. 굿굿 좋네요 재구매 의사 완전 있습니다~~ 잘 쓸 것 같아용ㅎㅎ 엄청 유명하다길래 샀는게 그냥 무난한 수분크림이에요 ㅇ누아 보다 아주 약간 보습감 있는 정도? 진짜 맨날 쓰는 크림ㅠㅠㅠ 없으면 안됌…😢 너무 좋아요 흔적 잘 없어지고 촉촉하고… 진짜 설명이 필요없음",케이스 아쉽다 플라스틱 튜브 타입 좋다 여름 항상 꾸다 크림 바르다 무덥다 땀송글송글 맺다 사보다 만족하다 꾸다 덕함 바르다 땡기다 채우다 느낌 화장 밀림 촉촉하다 건조하다 건성 추천 여름 바르다 크림 찾다 좋다 처음 무난 순하다 발림 좋다 크림 늘다 바르다 피부 확실하다 편안하다 무거워 좋다 지인 추천 해주다 구매 해봤다 좋다 무난 자극 순하다 건성 사용 보습 유지 약하다 복합 가볍다 일리 사용 좋다 흔적 효과 좋다 크림 용기 진짜 일반 튜브 끼다 좋다 굿굿 좋다 재다 의사 자다 쓸다 유명하다 사다 무난 수분크림 보습 정도 진짜 쓰다 크림 돼다 좋다 흔적 자다 없어지다 촉촉하다 진짜 설명 필요없다
[재구매율1위/비타민앰플] 피지오겔 사이언수티컬즈 데일리뮨 앰플 20ml+20ml 더블기획,"이거 예전에 한번 썼을 때 그때는 그냥 그랬는데 안쓰니까 효과 바로 차이남 얘 따라올애 없어요;; 가격대가 좀 있긴한데 세일 할 때 사십쇼들 생각보다 가볍고 끈적임 거의 없어요
바르자마자 싹 흡수돼서 아침에도 사용하기 좋아요 근데 아침에 바르면 선크림 꼭 발라야 한다고 하네요 일주일 아니 5일만 꾸준히 써도 효과 보여요ㅠㅠ 제가 피부가 민감한데 크게 자극 없었어요 저는 세일 할때만 쟁이는중,,,

여기까지 읽어주신분들 도움이 돼요 좋아요 버튼 눌러주시면 너무 감사드려요😍😍 리뷰에 다들 이게 뭐 자극이 없는거다 해서 샀는데 완전 자극 있어요. 바르고 나면 항상 얼굴에 뭐가 나서 안 발라요. 괜히
샀어요. 피부 컨디션이 예민할 때 사용하기 좋은 앰플이에요. 제형은 가볍지만 보습감은 충분해서 끈적임 없이 촉촉하게 흡수됩니다. 사용 후 피부가 편안해지는 느낌이 들고, 건조로 인해 푸석했던 피부가 한결 건강해 보였어요. 스킨케어 단계에서 부담 없이 사용할 수 있어 데일리 앰플로 만족스럽습니다.
약간 오일리한 느낌도 있어서 여름보다 겨울 추천해요 비싸고 좋은 화장품!!🥺
피부톤을 환하게 밝혀줘요
1+1기획일때 사야합니다.,!! 성분도 좋고 따가움 1도 없어요
엄마랑 나눠쓰기 좋아요! 가격이 저렴한 것도 아닌데 왜 스포이드 값을 아끼셨는지 모르겠지만..ㅠㅜ
주르륵 물처럼 흐르는 제형이라 바를때 반대손 대기타고 있어야해요. 또륵 하고 한방울 떨구자마자 바로 바르기!
향은 뭔가... 옛날 차ㅇ박 프로폴리스앰플같은 향?? 옛날에 써보고 안써봐서 지금도 같은 향인지는 모르겠지만 먼 옛날 맡아봤던 것 같은 추억이 떠오르는 향..? 비타민씨답게 비릿한 쇠냄새도 살짝 나요 한달사용 리뷰입니다

일단 바르고나면 흡수되면서 약간 따끔거리는데
제 입장에선 흡수된다는 느낌이 좋았어요

기능성 화장품이고 미백에도 좋다는데
진정에도 도움이 많이 되었던거같습니다

저는 꼭 리들샷으로 길 열어주고 썼고
재구매할거같아요 후기가 좋아서 구매해보아요
계속써보고 좋으면 후기 쓸께요",예전 써다 쓰다 효과 차이나다 따라오다 가격 대가 가볍다 적임 바르다 흡수 돼다 아침 사용 좋다 아침 바르다 선크림 발라 일주일 일만 꾸준하다 써다 효과 보이다 피부 민감하다 크게 자극 읽다 주신 도움 돼다 좋다 버튼 누르다 감사 드리다 리뷰 들다 자극 사다 자극 바르다 나다 항상 얼굴 나서다 발라 사다 피부 컨디션 예민하다 사용 좋다 앰플 가볍다 보습 감다 충분하다 적임 촉촉하다 흡수 사용 피부 편안하다 느낌 들다 건조 인하다 푸석하다 피부 한결 건강하다 보이다 스킨 케어 단계 부담 사용 일리 앰플 만족스럽다 일리 느낌 여름 겨울 추천 비싸다 좋다 화장품 피부 환하다 밝히다 획일 사다 성분 좋다 따갑다 엄마 나누다 쓰기 좋다 가격 저렴하다 스포이드 아끼다 모르다 주르륵 흐르다 바르다 대손 대기 타고 야하다 또륵 방울 떨다 바르다 옛날 프로폴리스 옛날 써다 써다 모르다 멀다 옛날 맡다 추억 떠오르다 비타민 비릿 냄새 살짝 사용 리뷰 바르다 흡수 거리 입장 흡수 느낌 좋다 기능 화장품 미백 좋다 진정 도움 되어다 리들샷 열다 써다 재다 후기 좋다 구매 해보다 계속 써다 좋다 후기 쓸다
