product_name,review,cleaned_review
[*1등 글로우립] 에스쁘아 노웨어 립스틱 바밍 글로우 3g 17 colors,"에스쁘아 노웨어 립스틱 바밍 글로우 16호 피치 바이브
너무 이뻐요 ㅎ 에스쁘아 노웨어 립스틱 바밍 글로우 발색 이뻐요 ~~!! ㅎㅎ 한 때 정말 찐 매트립 벨벳립만 바르고 살다가 요즘엔 글로우에 빠져있어요 근데 이번엔 저희 오마니가 글로우립에 빠지신 것 같아요 같이 손잡고 올리브영 오프라인 매장 갔다가 제 손등에 이색 저색 이 립스틱 저 틴트 발색 해 보시더니 ㅎㅎ
딱 이 에스쁘아 바밍글로우 헤이 베스티를 pick 하시더라구요 역시 우리 엄마 색잘알 브랜드 잘알
에스쁘아가 진짜 다른 것도 잘 하시만 제가 생각할 때 립 맛집이거든요? 유명한 라인도 이유가 있겠지만 유명하지 않은 라인도 찐 예쁜 템들이 많아요 하나하나 안 예쁜 컬러가 없음 글로우 립스틱이라 지속력이 그리 크게 좋진 않지만 뭐 어때요 이쁘니까 계속 바르면 되지 제 기준 입술 주름 잘 메꿔주는 편이라고 생각이 들었고 빠르게 쓸 것 같아서 재구매 예약입니다 다음에는 다른 이쁜 컬러 데리고 오려구요 엄마랑 또 같이 가야지 예상했던 색이 아님….. 완전 다름
후기가 괜찮아서 당황스러울 정도임….

뭔가 옛날 로드샵에서 팔던 흔하면서 촌스러운 핑크색1 정도예요
색 진짜로 촌스러움 제발 절 믿어보셈….

제 사진은 일부러 연하게 바르고 찍은건데요
그나마 색을 덜어내야 이쁠까 말까 한 정도네욥
굳이 이 색상으로 살 필요 절대 ㄴㄴㄴㄴ

그리고 착색은 거의 없는 거 같아요 금방 지워져요
니베아 립밤보다 촉촉한 거 같긴 하네요 불량 제품을 받았는데요^_^
교환하고 싶은데 일시품절이라고 교환 클릭도 안되고, 고객센터는 교환하라고만 답변하더니, 결국 품절이라 교환 불가능하니 반품 하라는 상담사 답변 받았습니다.
일부러 올영세일 기간 맞춰서 구매한건데 이렇게 제품 검수도 안하고 보내서 반품하는 번거로움과 할인이나 기획 혜택도 못 받는게 참 별로네요.
올리브영 절차 문제인지, 브랜드 문제인지는 모르겠지만 나중에 품절 풀려도 별로 이용하고 싶지 않네요:) 립펜슬까~쥐 기획으로 주고 요 라인은 로드샵치고 가격은 있지만 발린성 굿 립 틴트 같은 재형인데 정말 부들부들하게 잘 팔려요. 발색도 진하고 아주 마음에 듭니다. 특히 색깔이 너무 너무 예뻐서 만족스러워요.",에스쁘 웨어 립스틱 바밍 로우 피치 바이브 이쁘다 에스쁘 웨어 립스틱 바밍 로우 발색 이쁘다 찌다 매트 벨벳 바르다 살다 로우 빠지다 말다 로우 빠지다 손잡다 올리브영 오프라인 매장 가다 손등 이색 립스틱 틴트 발색 에스쁘 바밍 로우 헤이 베스티 엄마 잘알다 브랜드 잘알다 에스 아가 진짜 자다 맛집 거들다 유명하다 라인 이유 유명하다 라인 찌다 예쁘다 많다 예쁘다 컬러 로우 립스틱 지속 그리다 크게 좋다 어떻다 이쁘다 계속 바르다 기준 입술 주름 자다 꾸다 들다 빠르다 쓸다 재다 예약 이쁘다 컬러 데리 오다 엄마 가야 예상 다르다 후기 괜찮다 당황 스럽다 정도 옛날 로드 파다 흔하다 촌스럽다 핑크색 정도 진짜 촌스럽다 제발 믿다 사진 일부러 연하다 바르다 찍다 덜다 이쁘다 말다 정도 굳이 색상 필요 절대 착색 금방 지워지다 니베아 립밤 촉촉하다 불량 제품 받다 교환 싶다 품절 교환 클릭 안되다 고객 센터 환하다 답변 품절 교환 불가능하다 반품 하라 상담사 답변 받다 일부러 기간 맞추다 건데 제품 검수 보내다 반품 번거롭다 할인 기획 혜택 받다 차다 별로 올리브영 절차 문제 브랜드 문제 모르다 품절 풀다 별로 이용 싶다 립펜슬까 기획 주다 라인 로드 가격 발린 틴트 재형 부들부들하다 자다 팔다 색도 진하다 마음 듭니 색깔 예쁘다 만족스럽다
[1+1+증정/광채탄력] 닥터지 블랙스네일 크림 50ml 1+1 기획 +(15ml 추가 증정),"닥터지 블랙스네일 크림 50미리 제품 행사로 구매했어요. 1+1에 작은 15미리 추가 증정이라서 엄청 꽉꽉 채워서 주시네요.
올영 세일기간에 할인된 금액으로 저렴하게 구매했습니다.

블랙스네일과 프로폴리스 함유로 쫀쫀하고, 사용감이 좋아요. 생각보다 무겁지 않아서 사계절 쓰기 괜찮을거 같고, 며칠 사용하니 주름이 펴지는 느낌이 들정도로 효과도 좋았어요.

닥터지 제품이 성분도 좋고 순하고 가격도 착해서 맘에 들어요. 재구매 의사 있습니다. 구매 추천드려요~ ​[항암 중 무너진 탄력+극건조 한 번에 잡았어요!! 끈적임 없는 찐 고보습 크림 🐌✨]

​피부 타입: 항암 치료 중 극민감성 + 속건조 폭발 + 탄력 저하

​총평: ⭐X5(재구매 의사 200%)

​요즘 치료 받으면서 피부 장벽이 완전히 깨졌는지, 아무리 수분크림을 발라도 푸석하고 겉탄력까지 뚝뚝 떨어져서 고민이었거든요ㅠㅠ 민감성 피부라 기능성 크림 쓰기 무서웠는데, 닥터지 블랙 스네일은 진짜 순함 그 자체예요! 따가움이나 뒤집어짐 1도 없이 쫀쫀하게 밀착됩니다.

​👍 마음에 쏙 든 장점
​미추어버린 보습 지속력: 밤에 바르고 자면 다음 날 아침까지 피부가 보들보들하고 당김이 전혀 없어요.
​자극 없는 탄력 케어: 스네일 성분 덕분인지 푸석했던 피부 밀도가 쫀쫀하게 차오르는 게 만져져요.


​👎 솔직히 아쉬운 단점
​영양감이 풍부한 리치한 제형이라 아침에 듬뿍 바르면 화장이 살짝 밀릴 수 있어요ㅋㅋ 아침엔 소량만 톡톡!


​💡 나만의 찰떡 시너지 꿀팁!
세안 후 대나무 히알루로 속수분을 먼저 가볍게 채워준 다음에 이 크림을 얇게 얹어보세요! 겉돌지 않고 영양이 쏙쏙 흡수되면서 보습막이 짱짱하게 형성됩니다.
저처럼 건강 관리하면서 순하고 확실한 안티에이징 크림 찾으시면 무조건 올영 세일 때 쟁이셔야 합니다!! 아침보다 밤에 듬뿍 바르고 자는 용도로 더 잘 맞는 제품이었어요. 아침에는 화장이 살짝 밀릴수도 있따는... 보습과 탄력 관리를 동시에 하고 싶어서 사용해봤는데 기대 이상으로 만족스러웠습니다. 크림 제형은 쫀쫀하지만 피부에 바르면 부드럽게 펴 발리고 흡수됩니다.

아침저녁으로 사용한 결과 피부가 한층 촉촉해졌고, 푸석했던 피부에 윤기가 생겼어요. 특히 아침에 일어났을 때 피부 컨디션이 좋아 보이는 점이 만족스러웠습니다.

건조함과 탄력 저하가 고민인 분들에게 추천할 만한 제품입니다. 이 제품을 몇통째 쓰는지 모르겠어요 .....

잠 못자고 이것만 발라도 잠 많이 잔 피부처럼 꿀광 만들어주고 안티에이징 효과를 확실히 느끼게 해줍니당

꾸덕해서 건성한테도 너무 잘맞고 밤에 싹 써주면 아침에 안색이 환해지는 광명템 .. 팀악건성들 이거 꼭 쓰세요🤍 쫀쫀하면서도 너무 무겁지 않은 크림 제형이라 피부에 부드럽게 밀착되는 느낌이에요. 바른 직후에는 살짝 윤기가 돌면서 피부가 촉촉하게 코팅된 듯한 느낌이 들고, 다음 날까지 건조함 없이 유지되는 점이 좋았어요. 특히 피부가 푸석하거나 탄력이 떨어졌을 때 사용하면 피부결이 한층 매끈해 보이는 효과가 있습니다.

블랙 스네일 성분 특유의 영양감 덕분에 피부 장벽을 탄탄하게 잡아주는 느낌도 들고, 꾸준히 사용하면 피부가 좀 더 탄력 있고 건강해 보이는 느낌이에요. 끈적임은 적당한 편이라 밤에는 물론, 양 조절하면 메이크업 전에 사용해도 부담 없는 수준입니다.",닥터 블랙 스네일 크림 미리 제품 행사 구매 작다 미리 추가 증정 채우다 주다 기간 할인 금액 저렴하다 구매 블랙 스네일 프로폴리스 함유 쫀쫀 용감 좋다 무겁다 사계절 쓰기 괜찮다 며칠 사용 주름 펴다 느낌 들다 정도 효과 좋다 닥터 제품 성분 좋다 순하다 가격 착하다 들다 재다 의사 구매 추천 드리다 항암 무너지다 탄력 건조 잡다 적임 찌다 보습 크림 피부 타입 항암 치료 민감 건조 폭발 탄력 저하 재다 의사 치료 받다 피부 장벽 완전하다 깨지다 수분크림 발라 푸석하다 탄력 떨어지다 고민 민감 피부 기능 크림 쓰기 무섭다 닥터 블랙 스네일 진짜 순하다 자체 따갑다 뒤집어지다 쫀쫀하 밀착 마음 들다 장점 미추 버리다 보습 지속 바르다 자다 아침 피부 보들보들하다 당기다 전혀 자극 탄력 케어 스네일 성분 덕분 푸석하다 피부 밀도 쫀쫀하 차오르다 만지다 솔직하다 아쉽다 단점 양감 풍부하다 리치 아침 듬뿍 바르다 화장 살짝 밀리다 아침 소량 톡톡 찰떡 시너지 꿀팁 세안 대나무 히알루 수분 먼저 가볍다 채우다 크림 얇다 얹다 돌다 영양 쏙쏙 흡수 보습 짱짱하다 형성 건강 관리 순하다 확실하다 안티 이징 크림 찾다 무조건 쟁이셔 아침 듬뿍 바르다 자다 용도 자다 맞다 제품 아침 화장 살짝 밀리다 따다 보습 탄력 관리 동시 싶다 사용 해봤다 기대 만족스럽다 크림 쫀쫀하 피부 바르다 부드럽다 펴다 발리 흡수 아침 저녁 사용 결과 피부 한층 촉촉하다 푸석하다 피부 윤기 생기다 아침 일어나다 피부 컨디션 좋다 보이다 만족스럽다 건조하다 탄력 저하 고민 추천 제품 제품 통째 쓰다 모르다 못자다 발라 피부 꿀광 만들다 안티 이징 효과 확실하다 느끼다 해주다 꾸다 건성 잘맞다 써주다 아침 안색 환하다 광명 팀악 건성 쓸다 쫀쫀 무겁다 크림 피부 부드럽다 밀착 느낌 바르다 직후 살짝 윤기 돌다 피부 촉촉하다 코팅 느낌 들다 건조하다 유지 좋다 피부 푸석하다 탄력 떨어지다 사용 피부 한층 매끈하다 보이다 효과 블랙 스네일 성분 양감 덕분 피부 장벽 탄탄하다 잡다 느낌 들다 꾸준하다 사용 피부 탄력 건강하다 보이다 느낌 적임 적당하다 조절 메이크업 사용 부담 수준
[1+1/1등 모공 수분천재크림] 에스네이처 아쿠아 스쿠알란 수분크림 60ml 더블기획,"안타깝게도 이걸 쓴 저희 모녀 피부에 모두 트러블이 났습니다. 제가 쓰기엔 유분이 많은가 싶어서 어머니께 드렸는데 어머니도 생전 나지 않던 트러블이 났습니다 쓰고 있던 제품1개 아직 개봉도 안한 제품1개까지 모두 폐기했습니다 더운 여름에 피지끼지말라고 구매했습니다 수분감 넉넉한데 건성이면 기름진거 한겹 더 깔아야 할 듯 합니다 웬 아저씨가 모델이 된 이후 남은 수분크림마저 기분 나빠서 손이 안가네요 이거 바르면 아저씨 냄새날거같은 이미지임 번들거림보다 은은한 윤기가 남는 편이라 만족했어요 아침저녁으로 잘 쓰는 중입니다 에스네이처에서는 수분크림이 입문템이에요.
평이 하도 좋다는건 알았지만 친구한테 선물받아서 처음 사용해봤습니다.
무겁지도 또 너무 가벼워서 바르자 마자 날아가버리는 그런 제형이 아닙니다. 크림처럼 부드럽게 펴발리고 촉촉하면서도 유지력을 높여줄 수 있는 얇은 보습막.
이게 신의한수더라구요.
특히 요즘같은 계절에는 무조건 쟁여야하는 여름철 스킨케어 필수템입니다. 겨울리면 건성들은은 많이 약하다 느껴질수있지만 지금응 피부타입도 안가리고 좋을 듯해요. 에스네이처 이 수분크림만 몇통째인지 모르겟어요
막 좋아서 쓰는게 아닌
무난해서 손이 잘 가길래
게다가 또 없으면 얼굴이 땡겨서 필수로 꼭 발라요 수분크림으로서만 기능해서 요즘같은 고기능 화장품 시대에 안 맞는 듯 하기도 하지만!
오히려 아무 기능이 없어서 손이 많이 가요. 휘뚤마뚤 크림입니다!
발림도 부드럽고 수분감도 좋아요!
한겨울에는 살짝 부족한 수분감, 한여름에는 넘치는 수분감...이긴한데... 다른 기초로 원만한 합의 보면서 쓰고있습니다ㅎㅎ 오늘 특가 검색하던 중에
2개 세트로 저렴하게 판매하는 것 보고 얼른 구매했어요.
여름에 쓸 수분크림 찾고 있는데
기름지지 않고 딱 수분 보호막만 씌워주는 용도로 아주 좋을 것 같음
튜브 형태로 돼 있어서 편리하고 위생적인 것도 맘에 들어요

애매한 사은품 없이 본품만 두 개로 실하게 구성돼서 실속도 있고 완전 맘에 듦

에스네이처 파란색 앰플도 정말 잘 썼는데 수분크림도 정말 기대됩니다.",안타깝다 쓸다 모녀 피부 트러블 나다 쓰기 많다 싶다 어머니 드리다 어머니 생전 나다 트러블 나다 쓰다 제품 개봉 제품 폐기 덥다 여름 피지 끼다 구매 수분 넉넉하다 건성 기르다 깔다 아저씨 모델 남다 수분크림 기분 나쁘다 알다 바르다 아저씨 냄새 날다 이미지 들다 림보 은은하다 윤기 남다 만족하다 아침 저녁 자다 쓰다 에스 네이처 수분크림 입문 평이 좋다 알다 친구 선물 받다 처음 사용 해봤다 무겁다 가볍다 바르다 마자 날아가다 버리다 크림 부드럽다 펴다 발리 촉촉하다 유지 높이다 얇다 보습 신의한수 덥다 계절 무조건 야하다 여름철 스킨 케어 필수 겨울 건성 약하다 느껴지다 피부 타입 가리다 좋다 에스 네이처 수분크림 통째 모르다 좋다 쓰다 무난 자다 가다 얼굴 땡기다 필수 발라 수분크림 기능 기능 화장품 시대 맞다 기능 가요 휘뚤마뚤 크림 발림 부드럽다 수분 감다 좋다 한겨울 살짝 부족하다 수분 한여름 넘치다 수분 이기다 기초 원만하다 합의 쓰다 오늘 검색 세트 저렴하다 판매 얼른 구매 여름 쓸다 수분크림 찾다 기름 지지 수분 보호 씌우다 용도 좋다 튜브 형태 돼다 편리하다 위생 들다 애매하다 사은 실하다 구성 돼다 실속 들다 에스 네이처 파란색 앰플 자다 써다 수분크림 기대
[1+1/급속진정 장벽개선] 레이어랩 니오좀 판테놀 5% 세럼 30ml+30ml 더블 기획,"🥰좋았던 점
- 흐르는 제형이 아니고 약간 쫀쫀한 제형이라 건성이 사용해도 건조하다고 느끼지 않았어요.
- 일주일 정도 바르니까 피부가 달라지는 게 느껴져요. 뭔가 더 보드라워진 느낌이에요.

😥별로 였던 점
- 없어요 요즘 피부가 좀 예민해져서 아무거나 바르면 바로 뒤집어지는데ㅜㅜ 이건 바르면 피부가 편안해지는 느낌이라 좋았어요ㅎㅎ 제형은 살짝 쫀쫀한데 막 무겁거나 답답한 느낌은 아니고 흡수 잘돼서 막 쓰기 좋앗어요!
세안하고 바로 발라주면 속당김 잡히는 느낌!!! 겉은 괜찮은데 속이 당기는 느낌 있을 때 발라주면 촉촉함이 오래 유지되는 느낌이라 만족했어욤 그리고 피부 붉어졌을 때 발라주면 뭔가 진정되는 느낌이에용
며칠동안 아침저녁으로 발랐는데 피부컨디션이 확실히 좋아져서 좋아용 좁쌀 좀 들어간 것 같아요!! 요즘처럼 햇빛이나 자외선으로 인한 피부손상이 염려될 때에는 기초부터 튼튼하게 관리해 줘야 하는 것 같아요. 급속진정된다는 문구가 마음에 들어서 구매했는데 정말 잦은 피부 트러블에 속이 상했는데 제품하나를 잘 사용하니까 피부가 트러블 생기기 전보다 훨씬 좋아진 것 같네요. 주름미백에좋고 급속진정에 좋다고하길래
구매를 해봤는데 진정은 잘모르겠네요
일단 바르고나면 좀 번들거리면서 끈적임은
있어요
근데 흡수되고나면 나아지는거 같아요
바르고난 다음날 세수를 하면 피부가
부드러운정도?
아직 몇번만 사용을해서 잘모르겠는데
저는 더운날씨보다 가을부터 바르면
좋을거 같은 생각이 드네욪 사용할 때마다 기분 좋아지는 제품이에요.
이 제품 같은 라인을 사용하면 더 효과가 좋은 것 같은데
종류도 다르고 제품의 중요점도 다르니까 비교해보고 구매하시면 더 좋을 것 같습니다.
저는 이 제품을 적극 추천합니다. 수분감이 남달라요 ~!!
평소에 피부가 민감하고 건조해서 아무거나 못바르는데 이거바르고 나면 다음날 아침에 엄청 수분감 쫀쫀해서 화장도 잘먹고 피부장벽도 튼튼해진 것 같아요!!
간만에 정착템 찾아서 대만족중이에요. 또재구매하러 올 예정입니다^^",좋다 흐르다 쫀쫀 건성 사용 건조하다 느끼다 일주일 정도 바르다 피부 달라지다 느껴지다 보드랍다 느낌 별로 피부 예민하다 거나 바르다 뒤집어지다 이건 바르다 피부 편안하다 느낌 좋다 살짝 쫀쫀한데 무겁다 답답하다 느낌 흡수 돼다 쓰기 좋다 세안 바르다 잡히다 느낌 괜찮다 속이다 당기다 느낌 바르다 촉촉하다 유지 느낌 만족하다 피부 붉다 바르다 진정 느낌 며칠 아침 저녁 바르다 피부 컨디션 확실하다 좋아지다 좋다 좁쌀 들어가다 햇빛 자외선 인하다 피부 손상 염려 기초 튼튼하다 관리 주다 급속 진정 문구 마음 들어서다 구매 잦다 피부 트러블 속이다 제품 자다 사용 피부 트러블 생기다 전보 좋아지다 주름 미백 좋다 급속 진정 좋다 구매 해봤다 진정 모르다 바르다 거리 면서 적임 흡수 나아지다 바르다 세수 피부 부드럽다 정도 몇번 사용 을해 모르다 덥다 날씨 가을 바르다 좋다 드네욪 사용 기분 좋아지다 제품 제품 라인 사용 효과 좋다 종류 다르다 제품 중요 점도 다르다 비교 해보다 구매 좋다 제품 적극 추천 수분 남다르다 평소 피부 민감하다 건조하다 거나 바르다 바르다 나다 아침 수분 쫀쫀해 화장 먹다 피부 장벽 튼튼하다 간만 정착 찾다 만족 재다 오다 예정
[1+1/깐달걀피부결] 이니스프리 레티놀 시카 흔적 앰플 30ml 더블 기획,"진짜 제발 영원히 팔아줬음 좋겠다....

나-이니스프리레티놀시카흔적앰플=0 수준

이거 바르기 시작하면서 얼굴 흉터랑 전체적인 컨디션이 엄청 좋아졌어요. 흉터도 옅어지고 피부결도 좋아지고, 신체 컨디션이 안좋아도 피부 상태는 일관적으로 유지되더라고요

특히 다음날 기름지지도 않아서 좋아요.
☆근데 이건 수분크림을 좀 과하게!!! 발랐을 때 이런 듯 유수분 벨런스 딱 맞추면 다음날에 개기름 안올라오고 보송한 피부를 가질 수 잇음... ☆

적응 때문에 보습크림이랑 섞어 쓰는데 앞으로도 이렇게 꾸준히 사용할 것 같네요. 함량이나 자극이 적어서 과연 이 제품이 효과가 있을지 의문이 드는 제품인데 사용하고 나면 피부 결이 확실히 부드러워져서 신기한 제품임 <내돈내산 솔직 리뷰>
직접 사용해보고 남기는 후기입니다 !
만족도 : ⭐️X5

이니스프리 레티놀 시카 흔적 앰플

피부에 남은 잡티 흔적과 울긋불긋한 자국이 신경 쓰여 구매했는데 꾸준히 사용하기 좋은 제품이었습니다. 레티놀 제품은 자극이 걱정됐는데 이 제품은 시카 성분이 함께 들어 있어서 그런지 비교적 부담 없이 사용할 수 있었어요.

제형은 가볍고 산뜻한 편이라 끈적임 없이 흡수되었고, 저녁 스킨케어 단계에서 사용하기 좋았습니다. 피부가 예민한 날에도 큰 자극 없이 사용할 수 있었고, 꾸준히 바르다 보니 피부결이 조금 더 정돈되는 느낌을 받았습니다.

더블 기획 구성이라 넉넉하게 사용할 수 있어 좋았고, 가격 대비 만족도도 높았습니다. 레티놀을 처음 시작하는 분들이나 부담 없이 피부 관리를 하고 싶은 분들에게 추천하고 싶은 제품입니다. 나비존에 피부 요철, 모공 늘어짐이 늘 고민이라 다양한 제품을 써봤는데, 레티놀이 좋다길래 한번 구매해봤어요! 이 제품이 레티놀 제품 중에 가장 순하다고 해서 입문용으로 구매하였고 거즘 2주동안 쭉 사용하다가 갑자기 피부가 뒤집어져서 중단 후 최근에 다시 사용 시작했습니다🥲
사용 초반: ‘깐달걀’처럼 피부가 매끈매끈+속광이 생겼고, 평소랑 똑같은 제품으로 피부 화장했을 때 피부가 매끈해보인다고 들었어요! 처음에는 생각보다 많이 따갑다!! 특히 눈 주변 등 피부가 제일 얇은 부분에서 많이 따갑다고 느꼈고 한 30초는 눈을 못 뜰 정도로 화끈하고 아팠어요
사용 2주차?쯤에는 갑자기 피부가 뒤집어져서 중단 후 진정 제품으로 사용하다가 최근 3일전부터 다시 사용하기 시작했어요. 그런데… 볼이나 이마, 코 등 피부가 상대적으로 두꺼운 부분은 자극 없이 괜찮은데… 눈가에 오돌토돌하게 빨갛게 올라와요ㅠㅠㅠㅠ 밤에만 바르고 자고 일어나면 붉은 기는 가라 앉는데.. 없던 눈가 요철이 생겨서.. 아쉬워요 나 이걸로 레티놀 입문했는데 남친한테 사라고 ㅈㄴ 영업중임 벌써 병이 좀 가벼움 ㅋㅋ
근데 나 구순염틴트써서 구순염걸렸는데 이거 입술에 닿으면 구순염 도짐 조심하셈 아무래도 자극이 있어서 그런듯! 전 자극 없는줄 알았는데 이거바른지 3주째쯤 얼굴에 여드름 아닌 무언가가 올라옴
피부과까지 다니면서 스테로이드 치료중이에요ㅠ
생긴지 한달이 지났는데도 아직도 안사라지네요....
레티놀은 안쓸듯 ㅜ 🤍이니스프리 레티놀 시카 흔적 앰플🤍
옵션: 30+30ml+뚱시바키캡

뚱시바 키캡까지 증정되는 제품이라서
바로 구매!

키캡도 너무 귀엽고, 무엇보다
레티놀 시카 흔적 앰플 사용후
다음날 피부결이
너무 보들보들해져서 좋아용!

소비기한 20280819까지
넉넉해서 좋아요~!",진짜 제발 영원하다 주다 좋다 이니스프리 레티 놀다 흔적 수준 바르다 시작 얼굴 흉터 전체 컨디션 좋아지다 흉터 옅다 피부 좋아지다 신체 컨디션 안좋다 피부 상태 일관 유지 기름 지지도 좋다 이건 수분크림 바르다 이렇다 유수 벨런스 맞추다 기름 올라오다 보송하다 피부 가지다 잇다 적응 보습 크림 섞다 쓰다 꾸준하다 사용 함량 자극 적다 제품 효과 의문 들다 제품 사용 나다 피부 확실하다 부드럽다 신기하다 제품 솔직 리뷰 직접 사용 해보다 남기다 후기 만족도 이니스프리 레티놀 흔적 앰플 피부 남다 잡티 흔적 울긋불긋하다 자국 신경 쓰이다 구매 꾸준하다 사용 좋다 제품 레티놀 제품 자극 걱정 돼다 제품 성분 들다 비교 부담 사용 가볍다 산뜻하다 적임 흡수 되어다 저녁 스킨 케어 단계 사용 좋다 피부 예민하다 크다 자극 사용 꾸준하다 바르다 피부 정돈 느낌 받다 더블 기획 구성 넉넉하다 사용 좋다 가격 대비 만족도 높다 레티놀 처음 시작 부담 피부 관리 싶다 추천 싶다 제품 나비 피부 요철 모공 늘어지다 고민 다양하다 제품 써다 레티놀 좋다 구매 해봤다 제품 레티놀 제품 순하다 입문 구매 거즘 사용 피부 뒤집어지다 중단 최근 사용 시작 사용 초반 깔다 달걀 피부 생기다 평소 똑같다 제품 피부 화장 피부 매끈하다 보이다 들다 처음 따갑다 주변 피부 제일 얇다 부분 따갑다 느끼다 정도 화끈하다 아프다 사용 주차 피부 뒤집어지다 중단 진정 제품 사용 최근 일전 사용 시작 이마 피부 상대 두껍다 부분 자극 괜찮다 눈가 오돌토돌하다 빨갛다 올라오다 바르다 자고 일어나다 붉다 기다 가라 앉다 눈가 요철 생기다 아쉽다 레티놀 입문 남친 사라 영업 중임 벌써 가볍다 틴트 써다 걸리다 입술 닿다 도짐 조심 자극 자극 알다 바르다 얼굴 여드름 무언가 올라오다 피부 다니다 스테로이드 치료 생기다 달이 지나다 사라지다 레티놀 쓸다 이니스프리 레티놀 흔적 앰플 옵션 바키 시바 키캡 증정 제품 구매 키캡 귀엽다 레티놀 흔적 앰플 사용 피부 보들보들하다 좋다 소비 기한 넉넉하다 좋다
