product_name,review,cleaned_review
[6월올영픽/NEW컬러] 코스노리 이지 브로우 체인저 5회분 (톤 체인저 / 무드 체인저),"피부가 엄청 예민한 편인데 피부에 자극없이 쓰기 좋아용
하고 나서 트러블이 올라오거나 하지도 않아서 편하게 염색하고 하기도 좋고
색이 진짜 이쁘게 잘 나오기도 하면서도 흔한 색이고 하지도 않아서 처음 해본 색인데도 엄청 이쁘고 해서 맘에 들기도 하고
주변에서도 다들 염색하구 나서 잘 어울리고 이쁘다고 해서
색상도 맘에 들기도 하고 거기다가 5회 분이라서 다음에도 넉넉하게 쓸수있어서 좋아용 아이가 날씨더워졌다고 탈색했는데
눈썹색이 너무 헤어랑 맞지 않는다고

눈썹염색 하고싶다 해서 준비했어요

요아이 1제를2제 안으로 넣어 사용하는거라
우선 번거롭지 않아요
저는 번거롭고 혹시 눈에 자극될까봐 걱정했는데
생각보다 간편하고 냄새도 안났어요
그리고 함께온 브러쉬로 눈썹 결 방향으로 염색해주면 되요

아이한것 보고 저도 해봤는데 괜찮아요
눈쪽에 자극없이 색 예쁘게 잘되구요
생각보다 너무 간편해서 좋았답니다
집에서 초간댜 셀프로 가능요
여름철 헤어 밝게 하실분들께 강추요 코스노리 이지 브로우 체인저 크라우드 토프 사용해봤어요🤎✨
염색 후 색상이 너무 마음에 들어서 바로 재구매한 제품입니당!

너무 노랗지 않은 자연스러운 갈색 느낌이라 데일리로 사용하기 딱 좋았어요🙌
스크류 브러쉬도 같이 들어있어서 눈썹 결 정리하면서 사용하기 편하더라구요ㅎㅎ

아무래도 염색 제품이라 살짝 따가운 느낌은 있지만 닦아내고 진정시켜주면 저는 괜찮았습니다🥹
가격도 부담 없는 편이라 만족하면서 사용중이에요💖 눈썹 탈색은 종종하고 했는데 색이 이뻐보이고 흔한 색상이 아니라서 해보고 싶어서 바로 구매했어용
구성이 잘되어있기도 하고 해서 편하게 눈썹 염색하기 좋고
똥손인데도 엄청 편하게 사용할수있는거라서 편하게 염색하기도 좋고
색상도 진짜 이쁘게 잘나오고 해서 좋으면서
피부가 민감한 편인데도 피부에 자극적이지도 않아서
염색하기도 좋고
염색하고 나니까 피부톤이랑도 잘맞기도 하고 엄청 이뻐보이기도 해서
5회 다 쓰고 나면 재구매해서 꾸준히 하고 다니려구용 ​-.5회분 소분 포장이라 굳을 걱정 없고 매번 정량만 깔끔하게 사용 가능함.
​-.클라우드 토프 색상은 붉은기 빠진 애쉬 그레이 톤이라 자연스러운 눈썹 연출에 적합함.
​-.셀프 시술 특성상 도포량과 방치 시간에 따라 염색 진하기에 차이가 발생함.
(시간 준수 꼭!!! 살짝 개인차도있음~ 신랑에게테스트해본결과 저와 다른색 차이가남^^;)
​-.눈가 피부 상태에 따라 일시적인 자극이 있을 수 있으나 밀착력이 좋아 흘러내리지 않음.

초보도 쉽게 할수있고 색도 이쁘게나오고 가성비도 좋아서 재구매의사있는제품 직업 상 염색을 하거나 하기에는 어렵기도 하고 그랬는데
뭔가 분위기 전환도 하고 싶고 해서 찾아보다가
눈썹 색을 셀프로 염색할 수 있다고 해서 구매했는데
진짜 편하게 집에서도 혼자 편하게 염색하기도 좋기도 하고
눈썹 색 바꾸고 나니까 뭔가 인상이나 분위기도 달라보이는 느낌도 들기도 하고 하면서 화장할때도 다양하게 하기 좋기도 해서 좋고
양도 넉넉하게 들어있고 해서 쓰기도 편해서 잘산거같아용",피부 예민하다 피부 자극 쓰기 좋다 나서다 트러블 올라오다 편하다 염색 좋다 진짜 이쁘다 자다 나오다 흔하다 처음 해보다 색인 이쁘다 들다 기도 주변 들다 염색 나서다 자다 어울리다 이쁘다 색상 들다 기도 거기 다가 넉넉하다 쓸다 좋다 날씨 더워지다 탈색 눈썹 헤어 맞다 눈썹염색 준비 넣다 사용 번거롭다 번거롭다 자극 걱정 간편하다 냄새 나다 브러쉬 눈썹 방향 염색 해주다 해봤다 괜찮다 눈쪽 자극 예쁘다 간편하다 좋다 초간댜 셀프 가능 여름철 헤어 밝다 강추 코스 노리 이지 브로 체인 크다 우드 토프 사용 해봤다 염색 색상 마음 들어서다 구매 제품 노랗다 자연스럽다 갈색 느낌 일리 사용 좋다 크류 브러쉬 들다 눈썹 정리 사용 편하다 염색 제품 살짝 따갑다 느낌 닦다 진정 괜찮다 가격 부담 만족하다 사용 눈썹 탈색 종종 이쁘다 보이 흔하다 색상 해보다 싶다 구매 구성 되어다 기도 편하다 눈썹 염색 좋다 똥손 편하다 사용 편하다 염색 좋다 색상 진짜 이쁘다 잘나오다 좋다 피부 민감하다 펴다 피부 자극 지도 염색 좋다 염색 피부 맞다 이쁘다 쓰다 나다 재다 꾸준하다 다니다 회분 포장 굳다 걱정 정량 깔끔하다 사용 가능하다 클라우드 토프 색상 붉다 빠지다 애쉬 그레이 자연스럽다 눈썹 연출 적합하다 셀프 시술 특성 도포량 방치 따르다 염색 진하다 차이 발생 준수 살짝 개인 차다 신랑 테스트 해보다 결과 차이 눈가 피부 상태 따르다 일시 자극 밀착 좋다 흘러내리다 초보 쉬다 색도 이쁘다 오다 가성 비도 좋다 재다 의사 제품 직업 염색 거나 어렵다 기도 분위기 전환 싶다 찾아보다 눈썹 셀프 염색 구매 진짜 편하다 편하다 염색 좋다 기도 눈썹 바꾸다 인상 분위기 달라 보이다 느낌 들다 기도 화장 다양하다 좋다 기도 좋다 양도 넉넉하다 들다 쓰기 편하다 잘살다
[6월올영픽/대용량] 라운드랩 1025 독도 로션 400ml,"벌써 10번이상 재구매한 아이템이고 기름기 없이 순한 물같은 로션이라 몸이나 얼굴 모두에 쓰기 좋습니다. 다 떨어지기 전에 바로바로 채워놔야하는 아이템이라고 생각해요. 세일 자주 해주심 좋겠고 로션+스킨 대용량 제품이 나왔음 좋겠어요. 근데 용기는 기존 타원형 용기로만 내주세요...펌프는 불편합니다. 리뷰 도움되셨다면 좋아요 부탁드려요:) 항상쓰고 데일리로 사용하는로션입니다 평생쓸예정입니담ㅁ 자극없이 순하고 끈적이지 않아 좋아요.대용량이라 엄청 오래 쌀 것 같아요. 대용량 대비 가격도 저렴한데
건조한 피부에 발라도 수분감이 있어서 너무 좋아요. 화장대에 항상 떨어지지 않는 독도로션입니다~
산뜻해서 좋아요 독도 로션은 독도 토너랑 같이 써주면 더 좋아용 순하고 부드러움!! 싸서 더 좋아요 너무 기름지지도않고 순한거같아요 겨울보다는 여름에 사용하기좋을거같아요 대용량이고 펌프여서 사용하기도 편하고 좋아요! 순해서 자주사용하네요👍🏻",벌써 구매 아이템 기름기 순하다 로션 얼굴 쓰기 좋다 떨어지다 채우다 놓다 야하다 아이템 자주 주심 좋다 로션 스킨 용량 제품 나오다 좋다 용기 기존 타원형 용기 로만 내주다 펌프 불편하다 리뷰 도움 좋다 부탁드리다 항상 쓰다 일리 사용 로션 평생 쓸다 예정 자극 순하다 좋다 용량 용량 대비 가격 저렴하다 건조하다 피부 발라 수분 좋다 화장 항상 떨어지다 독도 로션 산뜻하다 좋다 독도 로션 독도 토너 써주다 좋다 순하다 부드러움 싸다 좋다 기르다 순하다 겨울 여름 사용 좋다 용량 펌프 사용 편하다 좋다 순하다 자다 용하다
[6월올영픽/모공탄력]메디큐브 제로 모공 원데이 펩타이드 세럼 한교동 리필기획 (본품+리필팩50ml+한교동 거울키링),"리뉴얼 전 제일 처음 나온 원데이 모공세럼부터 써본 사람인데요?

음 이렇게 용기 바뀌고 솔직히 차이 전에 처음 느낀 그 느낌은 덜하긴 했아요?(꾸준히 발라서 그런가)

그런데 블랙헤드는 확실히 덜해졌고, 특 히!!
디바이스나 리들샷이랑 같이 발랐을 때 다음날 아침 얼굴니랑 화장 먹이고 난 후 피부 표현이 달랐음!!

(리들샷 + 디바이스기기 이거 무조건 다른 날 각각 해야함.. 나도 알고싶지 않았음.. 바로 피부과 감^^)

다들 야무지게 꾸준히 모공관리 데일리케어 하자구 ~ 메디큐브 피디알엔에만 빠져있었는데 이제 점점 날이 더워지면서 모공 신경을 안쓸래야 안쓸 수가 없죵…예전에 펌핑해서 썼었는데 리뉴얼되면서 스포이드라 오히려 더 좋았습니다, 제형이 생각보다 묽어서 주르륵 흘러내리는 텍스쳐입니다, 스킨케어 중에 제일 중요하게 생각하는데 무엇보다 피부 안정감이나 사용감인데 이게 바로 딱 원하던 사용감이라 좋았어요! 무겁거나 끈적이지 않고 가벼운데 건조하지 않고 쫀쫀한 마무리감이랄까..말로 표현을 잘 못 하겠는데 발라보면 아..이게 쫀쫀한 느낌이구나 생각들어요, 겉도는 것도 없고 피부가 답답하지 않아서 여름까지도 충분히 쓰기 좋을 것 같습니다, 요즘 최애 세럼ㅎ 촉촉하고 당김없고 여름만되면 모공 넓어지고 난리도 아닌대 이걸로 확실히 관리해야겠어요 세럼색도 이뻐서 바를때마다 기분이좋네요 ㅎㅎ 끈적거리지않아 여름에 사용하기 굿입니다 바를땐 엄청 흐르는 물제형인데 바르고 나면 흡수도 빠르고 피부결도 매끈해져서 좋은거 같아요 쎄일이라서 몇개 더쟁여두려고 구매 했어요 쓴지 몇일 안되어서 큰 변화는 없는거 같은데 여름에 쓰기에 적당한 세럼이에요~흘르는 제형이라서 바를때 좀 주의해야
하는데 흡수 시키고 나면 피부가 매끈해지고 뽀송하네요~ 이젠엔 좀 끈적여서 색조할때 밀리고해서 저녁용으로만 쓰고 재구매 안했는데 리뉴얼되면서 밀리는 게 괜찮아졌다고해서 재구매 ㄱㄱ
오늘밤 쓰고 낼 기대해봅니다.
믿고 쓰는 메디큐브

이번 교동이 키링 넘 사랑스러워요. 긋!!",리뉴얼 제일 처음 나오다 원데이 써다 용기 바뀌다 솔직하다 차이 처음 느끼다 느낌 덜하다 꾸준하다 발라 런가 블랙 헤드 확실하다 덜하다 디바이스 리들샷 바르다 아침 얼굴 화장 먹이 피부 표현 다르다 리들샷 디바이스 기기 무조건 나다 알다 피부 들다 야무지다 꾸준하다 모공 관리 일리 케어 메다 큐브 피디 빠지다 더워지다 모공 신경 쓸다 래야 쓸다 수가 없죵 예전 펌핑해 써다 리뉴 얼다 면서 스포이드 좋다 묽다 주르륵 흘러내리다 텍스쳐 스킨 케어 제일 중요하다 피부 안정감 용감 원하다 용감 좋다 무겁다 가볍다 건조하다 쫀쫀 마무리 끄다 말로 표현 자다 발라 쫀쫀 느낌 들다 겉도 피부 답답하다 여름 충분하다 쓰기 좋다 최애 촉촉하다 당기다 여름 모공 넓어지다 난리 확실하다 관리 색도 이쁘다 바르다 기분 좋다 거리 여름 사용 바르다 흐르다 바르다 나다 흡수 빠르다 피부 매끈하다 좋다 쎄다 라서 몇개 더쟁 려고 구매 쓴다 안되다 크다 변화 여름 쓰기 적당하다 흐르다 바르다 주의 흡수 나다 피부 매끈하다 뽀송하다 색조 밀리 고해 저녁 쓰다 재다 리뉴 얼다 면서 밀리다 괜찮다 재다 오늘밤 쓰다 기대 해보다 믿다 쓰다 메다 큐브 교동 키링 넘다 사랑스럽다 긋다
[6월올영픽/미니립증정기획] 3CE 블러 워터 틴트 4.6g 20종 단품/기획,"전에 썼을 땐 워터 틴트 그 자체라서 착색이 넘 잘됐었는데.. 그래서 오랜만에 다시 산 건데… 지속력 왜이래요 ㅠㅠ 리뉴얼됐나 ㅠㅠㅠ

둘 다 동시에 발랐고 아래만 살짝 지워본 건데 손등에만 조금 효과있지 입술은… … … 말을 아낄게오

싹싹 긁어서 다 썼던 전과 달리 조금.. 음 워터 틴트 하나
필요해서 산 건데 지속력이 꽝이니 굳이.. 싶어요 ㅠㅠ 여쿨 찰떡컬러 핑크구아바 쿨한 핑크컬러 좋아하시고 잘어울린다면 후회없을 컬러! 발림성 좋고 착색도 오래가서 여름맞이 구매했어요 오랜만에 아주 마음에드는 립이에요 굿굿입니다 ٩(ᐛ)و 봄웜 찰떡컬러 코랄문 코랄 좋아하시고 잘어울린다면 후회없을 컬러! 발림성 좋고 착색도 오래가서 여름맞이 구매했어요 오랜만에 아주 마음에드는 립이에요 굿굿입니다 (งᐛ)ว (งᐖ)ว 21호 갈웜소프트 인간
착색 아주 굳 여리여리한게 아주 이쁨요 여쿨인데 체이싱로즈+레이다운 색상이 수상하게 잘받는 피부입니다
사실 체이싱로즈 깔고 레이다운만 안쪽에 톡톡 두드려주면 뇌쇄적인 듀~💋립 되는데
레이다운에 다포딜이 껴오더라구요..
쓰던 체이싱로즈는 아직 남아있어서 레이다운으로 사봤어요
갠적으로 체이싱로즈 미니립이 사은품으로 오면 좋았겠다 하는 자그마한.. 바람.. ㅋㅋ
다포딜은 저한텐 너무 쨍해서 좀 부담스럽네요
레이다운도 체이싱로즈 먼저 깔고 안쪽만 바르면 괜차는데, 풀립으로 바르니 약간 좀^^;; 저한텐 좀... 짙어요
암튼 색은 이쁨ㅇㅇ 3ce의 기본 틴트형 케이스+무광 깔끔하고 너무 이뻐요

핑크구아바색상 쿨톤추천이라는데 웜톤인 제가 써도 괜찮아요. 오히려 웜톤추천색상은 데일리로는 너무 진한느낌이라..

[입술에 올리기전 파데로 입술색 죽이거나 하지마시고 티슈로 유분기를 잡으신 뒤 팁에 묻은 틴트를 입구에서 적당히 덜어낸 뒤 얇게 올리는걸]] 추천드려요
너무 빠르게 음파음파나 브러쉬질하면 제품이 뭉치긴 하는데 곧 잘 펴집니다

그러니 꼭 얇게 한번 올리시고 시간두어 픽싱한 뒤 한 번더 올리시는거 추천해요
색깔 넘 예쁩니다 ㅠㅠ",써다 워터 틴트 자체 착색 넘다 돼다 지속 리뉴얼 돼다 동시 바르다 살짝 지우다 손등 효과 입술 아끼다 싹싹 긁다 써다 전과 달리 워터 틴트 필요하다 지속 굳이 싶다 찰떡 컬러 핑크 구아바 쿨하다 핑크 컬러 좋아하다 어울리다 후회 컬러 발림 좋다 착색 가다 여름 맞이 구매 마음 에드 굿굿 봄웜 찰떡 컬러 코랄 코랄 좋아하다 어울리다 후회 컬러 발림 좋다 착색 가다 여름 맞이 구매 마음 에드 굿굿 갈웜 소프트 인간 착색 굳다 여리다 여리다 이쁘다 체이싱로즈 레이 다운 색상 수상하다 받다 피부 체이싱로즈 깔다 레이 다운 안쪽 톡톡 두드리다 뇌쇄적 레이 다운 다포딜 끼다 쓰다 체이싱로즈 남다 레이 다운 사보다 체이싱로즈 미니 사은 오다 좋다 자그마하다 바람 다포딜 한텐 쨍해 부담스럽다 레이 다운 체이싱로즈 먼저 깔다 안쪽 바르다 차다 풀리다 바르다 한텐 짙다 이쁘다 기본 틴트 케이스 무광 깔끔하다 이쁘다 핑크 구아바 색상 쿨톤 추천 웜톤 써다 괜찮다 웜톤 추천 색상 일리 진하다 느낌 입술 올리다 기전 파다 입술 죽이다 말다 티슈 분기 잡다 묻다 틴트 입구 적당하다 덜다 내다 얇다 올리다 추천 드리다 빠르다 음파 음파 브러쉬 지다 제품 뭉치다 자다 펴다 지다 얇다 올리다 두다 픽싱 번더 올리다 추천 색깔 넘다 예쁘다
[6월올영픽/미스트형] 라운드랩 1025 독도 토너 300ml 1+1 기획 (+늘어나는 스킨패드 30매),"아들이 스킨 조금 밖에 안 남아서 구입 했어요~ 너믄 너무 좋아요 ㅎㅎ 일단 토너는 이것만 씀. 이유는 모르겠고 제일 물같고(실재 성분도 거의 물) 순함.(물이라서 순함.) 근데 감다살 기획 나왔길래 사봄. 결론은 무조건 ㄱㄱ 이번 기획 감다살 이만큼 순하고 좋은 토너없음.. 독도시리즈 꾸준하게 넘 잘쓰고있어용🩵 저는 이 토너를 닦토용으로 사용했는데요… 확실히 각질은 없는 것 같긴 해요. 그리고 진짜 물같은 느낌?? 되게 흡수는 잘되고 촉촉하긴 해여. 근데 좀 건성 중인 분들ㅈ ㅜㅇ에서도 난 유독 건조하다 하신 분들은 건조할 것 같아요 솔직히… 좀 재구매를 많이 했긴 하지만 너무 비싸서 솔직히 다음에 사기에는 고민돼요 가격에 기능이 비례를 하면 괜찮은데 전 솔직히 잘 모르겠네여 완전 물 같은 토너예요 에스테틱에서 물 토너 쓰라 해서 이걸로 구매했어요 충전 해 주고 좋아요 무난 무난 합니다
독도 토너 추천합니다 완전 물 같은 토너예요 에스테틱에서 물 토너 쓰라 해서 이걸로 구매했어요 충전 해 주고 좋아요 무난 무난 합니다~!! 남친사줬는데 피부좋아졌다고 독도라인 전부구입했어영ㅎㅎ성분도 착하고 예민한남친피부에도 찰떡인독도최고!♡ 피부가 드라마틱하게 달라지진 않지만 나쁘지 않은 가격에 대용량, 그리고 리뷰가 좋아서 구매해봤어요. 사실 아직도 토너유목민으로서 강추드리기는 효과가 어떻다고 말하기는 애매한것 같아요. 그래도 세수 끝내고 바로 얼굴 땡길 때 발라주기 괜찮습니다. 재구매는 모르겠어요. 가격착하고 양많고 순한 토너를 찾아서..",아들 스킨 남아 구입 좋다 토너 쓰다 이유 모르다 제일 실재 성분 순하다 물이 순하다 감다 기획 나오다 사보다 결론 무조건 기획 감다 순하다 좋다 토너 독도 시리즈 꾸준하다 넘다 잘쓰다 토너 닦다 토용 사용 확실하다 각질 진짜 느낌 흡수 촉촉하다 건성 중인 유독 건조하다 건조하다 솔직하다 구매 비싸다 솔직하다 사기 고민 돼다 가격 기능 비례 괜찮다 솔직하다 자다 모르다 겠다 토너 에스테 토너 쓰다 구매 충전 주다 좋다 무난 무난 독도 토너 추천 토너 에스테 토너 쓰다 구매 충전 주다 좋다 무난 무난 남친 사주다 피부 좋아지다 독도 라인 구입 성분 착하다 예민하다 남친 피부 찰떡 독도 최고 피부 드라마틱하다 달라지다 나쁘다 가격 용량 리뷰 좋다 구매 해봤다 토너 유목민 강추 드리다 기다 효과 어떻다 애매하다 세수 끝내다 얼굴 땡기다 발라 주기 괜찮다 재다 매다 모르다 가격 착하다 많다 순하다 토너 찾다
[6월올영픽/벨벳증정기획] 연작 스킨 퍼펙팅 프로텍티브 베이스 프렙 25ml/40ml 기획/단품,"하도 좋다고 유명해서 사봤어요
저는 잘 모르겠긴 하네요
하지만 안써봤으면 계속 궁금햇겟지 너도 나도 다 있는 연작.
뭐가 그리 좋은가 나도 써보자 샀지만
굳이 베이스프렙 안써도
하도 화잘먹 기초들이 많이 나와서
손이 안가요ㅠ 💛 사용 후기

- 일반적인 프라이머와 달리 수분 에센스나 세럼처럼 촉촉하고 가볍게 발려 피부에 답답함 없이 얇게 밀착됨

- 파운데이션이나 쿠션을 올리기 전에 사용하면 들뜸이나 밀림 없이 화장이 쫀쫀하게 착 달라붙는 느낌임

- 기획 세트로 함께 구성된 10ml 증정품은 크기가 작아 파우치에 휴대하거나 여행용으로 챙겨가기 매우 유용함

💛 장점

- 각질을 잠재우고 매끈한 피부 바탕을 만들어주어 베이스 메이크업의 완성도와 지속력을 크게 높여줌

- 끈적임이나 과한 번들거림 없이 피부 속부터 차오르는 듯한 은은한 수분을 더해줌

- 수분감이 풍부해 건조한 계절이나 수부지/건성 피부도 속당김 없이 편안하게 메이크업을 유지할 수 있음


💛 아쉬운 점

- 베이스 치고는 가격대가 다소 높은 편이라 세일 기간이나 기획 세트가 아닐 때 구매하기엔 부담스러울 수 있음

- 연작 특유의 은은한 허브향이 나기 때문에 향에 민감한 사람에게는 호불호가 갈릴 수 있음

💛 총평
뛰어난 수분 밀착력 + 들뜸 방지 + 실용적인 기획 구성이라는 세 가지 강점이 돋보이는 제품. 베이스 메이크업이 자주 들뜨거나 뭉쳐서 고민인 분들의 화장 퀄리티를 높여주는 필수 '화장발' 아이템으로 적극 추천할 만함. 연작 베이스 프렙은 처음 써봤을 때 “피부 정리” 느낌이 꽤 확실하게 오는 제품이었어요 😊
세안 후에 바르면 피부 표면이 한 번 정돈된 것처럼 매끈해지고 다음 단계 제품이 더 잘 올라가는 느낌이 있었어요

제형은 묵직하지 않고 부드럽게 펴 발려서 부담 없었고, 여러 번 덧발라도 답답함이 크지 않았어요
특히 메이크업 전에 써보면 파운데이션이 뜨는 느낌이 덜하고 밀착력이 좋아지는 게 체감됐어요

건조한 날에도 당김 없이 편안하게 유지되는 편이라 데일리로 쓰기 괜찮았고, 향도 강하지 않아서 자극 없이 사용했어요
전체적으로 “기초 바탕을 깔끔하게 만들어주는 단계” 느낌이라 기본템으로 두기 좋은 제품이었어요 👍 다들 하도 좋다고 해서 사봤어요
아직 안써봤지만 비싼값 하지 않을까요..?
기대중입니다 아직 안써봤는데 다들 좋다고 해서 세일기간 통해서 사봤어요
오특이라해서 특히 싼줄알았는데 500원정도만 더 싸서 좀 아쉬웠지만 그래도 500원이라도 더 싼게 어디냐 싶기도하고ㅎ
한달차 후기에 좀 더 자세하게 남기도록 하겠습이당",좋다 유명하다 사보다 자다 모르다 써다 계속 궁금햇겟 나다 연작 그리다 좋다 나다 써다 사다 굳이 베이 스프 써다 먹다 기초 나오다 알다 사용 후기 일반 프라이머 달리 수분 에센스 촉촉하다 가볍다 발리다 피부 답답하다 얇다 밀착 파운데이션 쿠션 리기 사용 들뜨다 밀림 화장 쫀쫀하 달라붙다 느낌 기획 세트 구성 증정 품다 크기 작다 파우치 휴대 거나 여행 챙기다 유용하다 장점 각질 잠재우다 매끈하다 피부 바탕 만들다 베이스 메이크업 완성 지속 크게 높이다 적임 들다 피부 차오르다 은은하다 수분 해주다 수분 풍부하다 건조하다 계절 부지 건성 피부 편안하다 메이크업 유지 아쉽다 베이스 가격 대가 높다 기간 기획 세트 구매 부담스럽다 연작 은은하다 허브 나기 민감하다 호불호 갈릴 뛰어나다 수분 밀착 들뜨다 방지 실용 기획 구성 가지 강점 돋보이다 제품 베이스 메이크업 자주 들뜨다 뭉치다 고민 화장 퀄리티 높이다 필수 화장 아이템 적극 추천 연작 베이스 프렙 처음 써다 피부 정리 느낌 확실하다 오다 제품 세안 바르다 피부 표면 정돈 매끈하다 단계 제품 자다 올라가다 느낌 묵직하다 부드럽다 펴다 발리다 부담 여러 발라 답답하다 크다 메이크업 써다 파운데이션 뜨다 느낌 덜하다 밀착 좋아지다 체감 돼다 건조하다 당기다 편안하다 유지 일리 쓰기 괜찮다 강하다 자극 사용 전체 기초 바탕 깔끔하다 만들다 단계 느낌 두기 좋다 제품 들다 좋다 사보다 써다 싼값 대중 써다 들다 좋다 기간 통해 사보다 특이 싸다 알다 정도 싸다 아쉽다 싸다 싶다 기도 달차 후기 자세하다 남다
