product_name,review,cleaned_review
[단독기획] 토리든 다이브인 포맨 저분자 히알루론산 올인원 200g 더블 기획,"원래 스킨, 에센스, 로션 여러 단계 바르는 걸 귀찮아해서 올인원 제품 자주 사용하는데 이건 꽤 만족스러웠어요✨

일단 제형이 정말 가벼워요.

올인원 제품은 보통 끈적이거나 무겁게 마무리되는 경우가 많은데 이 제품은 수분젤 같은 느낌이라 피부에 바르면 금방 흡수되더라고요.

처음 바를 때는 “이거 보습 괜찮나?” 싶었는데 생각보다 속당김을 잘 잡아줘서 놀랐어요.

특히 세안 직후 피부가 당기는 날 발라주면 촉촉함이 꽤 오래 유지되는 느낌!

여름에는 무거운 크림 바르기 싫은데 이 제품은 답답함 없이 산뜻해서 아침에도 부담 없이 사용할 수 있었어요.

그리고 히알루론산 제품답게 피부가 수분 머금은 것처럼 탱탱해 보이는 느낌도 있어서 좋았어요💙

향도 강하지 않아서 호불호 적을 것 같고, 여러 단계 귀찮은 사람한테 딱 맞는 제품 같아요.

✔️ 수분 부족형 지성 피부
✔️ 산뜻한 올인원 찾는 분
✔️ 끈적이는 제품 싫어하는 분
✔️ 여름철 데일리 보습템 찾는 분

바쁜 아침에 이것 하나만 발라도 피부 컨디션이 꽤 괜찮아 보여서 손이 자주 가는 제품이에요💧✨ 이것저것 바르는거 귀찮아서 올인원제품 선호하는 남편이 무난하게 쓸수 있는 템이에요. 토리든 세럼 피부에 잘 맞고 순하니 좋아서
다른 유명템 올인원재치고 구매하게 되었어요
첫 도포 발림성은 토리든 수딩크림과 비슷하다라는 느낌이였고 수딩크림보다는 가벼워서 산뜻하고 끈적임없이 촉촉하게 스며들어서 올인원이지만 겨울철 사용 보다는
여름에 사용하기 좋겠다라는 생각이에요
◾️피부에 열감이 많아 붉으스름하신분
◾️간단하게 하나만챙겨 바르고 싶으신 분
◾️지성피부로 여름에 가벼운 제품을 찾고 있으신 분
추천드립니다
약간의 쿨링효과도 있어서 불그스름해질때 진정 대용으로 사용해도 좋을 듯 합니다 로션의 끈적임 싫어해서 스킨만 바르는 귀차니즘 분들한테 올인원이 최고입니다!!
여행용 미니사이즈 증정품으로 주는거 너무 좋은것같아요. 남자 화장품은 이런 미니 사이즈 따로 구하기 어려운것같아요ㅠㅠ 남편이 출장 여행때 잘쓰고 있어요!!

이번에 토리든 올인원은 처음 사봤어요.
이 제품 쓴지 2달정도된 여드름 민감성피부 남편이 산뜻하고 끈적임없고 촉촉해서 괜찮다고 하더라구요.
세일때 샀는데 15000원대라 가성비도 좋았어요👍
저도 얼굴에 써봤는데 자극없고 수딩크림처럼 발림성도
좋고 흡수도 빠른 편이라 겨울보다 여름에 쓰기 더 좋고건성분들한테는 조금 라이트할지도 몰라요. 토리든 세럼 피부에 잘 맞고 순하니 좋아서
다른 유명템 올인원재치고 구매하게 되었어요
첫 도포 발림성은 토리든 수딩크림과 비슷하다라는 느낌이였고 수딩크림보다는 가벼워서 산뜻하고 끈적임없이 촉촉하게 스며들어서 올인원이지만 겨울철 사용 보다는
여름에 사용하기 좋겠다라는 생각이에요
약간의 쿨링효과도 있어서 불그스름해질때 진정 대용으로 사용해도 좋을 듯 합니다",원래 스킨 에센스 로션 여러 단계 바르다 귀찮다 아해 올인원 제품 자주 사용 이건 만족스럽다 가볍다 올인원 제품 보통 거나 무겁다 마무리 경우 많다 제품 수분 느낌 피부 바르다 금방 흡수 처음 바르다 보습 괜찮다 싶다 자다 잡다 세안 직후 피부 당기다 바르다 촉촉하다 유지 느낌 여름 무겁다 크림 바르다 싫다 제품 답답하다 산뜻하다 아침 부담 사용 히알루론산 제품 피부 수분 금은 탱탱하다 보이다 느낌 좋다 강하다 호불호 여러 단계 귀찮다 맞다 제품 수분 부족 지성 피부 산뜻하다 올인원 찾다 제품 싫어하다 여름철 일리 보습 찾다 바쁘다 아침 발라 피부 컨디션 괜찮다 자주 가다 제품 바르다 귀찮다 올인원 제품 선호 남편 무난 쓸다 토리 피부 자다 맞다 순하다 좋다 유명 올인원 재치 구매 되어다 도포 발림 성은 토리 크림 느끼다 크림 가볍다 산뜻하다 적임 촉촉하다 스며들다 올인원 겨울철 사용 여름 사용 좋다 피부 많다 붉다 스름 신분 간단하다 챙기다 바르다 싶다 피부 여름 가볍다 제품 찾다 추천 드리다 쿨링 효과 스름 진정 대용 사용 좋다 로션 적임 싫어하다 스킨 바르다 귀차니즘 올인원 최고 여행 미니 사이즈 증정 주다 좋다 남자 화장품 이렇다 미니 사이즈 어렵다 남편 출장 여행 잘쓰다 토리 올인원 처음 사보다 제품 쓴다 정도 여드름 민감 피부 남편 산뜻하다 적임 촉촉하다 괜찮다 사다 원대 가성 비도 좋다 얼굴 써다 자극 크림 발림 성도 좋다 흡수 빠르다 겨울 여름 쓰기 좋다 건성 늘다 라이트 모르다 토리 피부 자다 맞다 순하다 좋다 유명 올인원 재치 구매 되어다 도포 발림 성은 토리 크림 느끼다 크림 가볍다 산뜻하다 적임 촉촉하다 스며들다 올인원 겨울철 사용 여름 사용 좋다 쿨링 효과 스름 진정 대용 사용 좋다
[단독기획]인터미션 레스트업 세럼스킨 290ml,"너무좋아요
저는 건성이고 지금 세통짼가 네통째 내돈내산으로 구매해서 쓰고잇어요 ㅎㅎㅎ
계속 재구매해서 쓸예정 진짜 건성 안건성은 함 써보세요

최근에도 하나샀었는데 남편이 이거쓰고좋아서 자기쓴다고 가져가서 제꺼 또 새로삼ㅋㅋㅋ그만큼 건성 진ㅉ ㅏ강추함

저번에 샀을때는 약간 통통한병에들어가잇엇는데 약간 길쭉하게 용기가바꼈네욤?ㅎㅎㅎ
바뀐게 더나은듯~~!!

약간 기능성세럼스킨?느낌이예요 ㅋㅋㅋ

저는 건성피부라서 특히겨울에는 어느 스킨 토너를 쓰던 얼굴당김잇어서 바로 앰플이나 크림바로발라주거든요!!

근데 인터미션 세럼스킨은 일반토너보다 확실히 조금 묵직한느낌의 토너라서 얼굴에바르면 잘 스며들면서 보습충전이 바로되서 너무좋아요 ㅠ_ㅠ

일반적으로 토너만바르면 바로얼굴당김 있잖아ㅛ..?
근데 이거는 없어요! 그래서 좀 스며들고나면 세럼바르고 크림발라주고잇어요

순하고 이거사용하면서 트러블일어난적없고 보습충전도잘되고 좋아요 계속 재구매할거예요! 저녁에 바르고자면 그담날 피부 보들해보이고 좋아요 푸석해보이는거전ㄴ혀없음! 건성에겐 너무나 좋네요 세럼과 로션이 합쳐진.느낌이랄까? 너무잘사용하고있어요
세럼같이묵직해서보습도되고
이제좀더운철에는하나만써도될꺼같아요
당분간은이스킨만쓸꺼같아요 피부타입 : 건성 민감성

순하고 보습 잘 되는 스킨 찾다가 인스타에서 보고 샀습니다. 사실 처음 들어보는 브랜드라 긴가민가했는데, 너무 좋아요!! 스킨이랑 세럼 딱 중간 제형이에요.

전에는 유명한 히알루론산 세럼 썼었는데 저는 잘 모르겠더라고요…? 이 제품은 3번 레이어링 했는데, 다음날 피부가 진정되고 보습이 빵빵하게 된 느낌이 났어요. 좀 더 써봐야하겠지만 일단 지금까지는 너무 좋습니다. 온가족템으로 자극 하나도 없고 정말 너무 좋아옹 ㅜㅜ 인생템입니당 온가족템이 사용하는 에센스예용 ㅎㅎ 너무 좋습니당 자극이 전혀 없어요 건성인데 속은 건조하고 겉은 유분 올라오는 수부지 타입이라 기초 잘못 쓰면 바로 답답하거나 트러블 올라오는 편인데, 인터미션 레스트업 세럼스킨은 진짜 잘 맞았어요! 엄마한테도 보내드림ㅋ

일단 제형이 일반 토너보다 살짝 점도 있는 세럼 느낌이라 바르는 순간 촉촉하게 감기는데 끈적임은 거의 없고 흡수도 빨라요. 여러 번 레이어링해도 무겁지 않아서 아침저녁 둘 다 사용하기 좋았어요.

특히 속건조 잡아주는 느낌이 좋아서 세안 후 당김이 많이 줄었고, 피부결도 좀 더 매끈해진 느낌! 유분만 겉도는 보습이 아니라 속까지 채워주는 느낌이라 수부지한테 잘 맞는 듯해요.

민감할 때 써도 자극 없었고 화장 전에 써도 밀림 없어서 만족했습니다. 요즘은 화장솜에 적셔서 스킨팩처럼도 쓰는데 피부 열감 진정되는 느낌도 있어서 손이 자주 가요.

✔️ 끈적이는 보습 싫은 건성/수부지
✔️ 속건조 심한 피부
✔️ 순하고 촉촉한 세럼토너 찾는 분들께 추천!",좋다 건성 째다 통째 구매 쓰다 잇다 계속 재다 쓸다 예정 진짜 건성 안건 성은 써다 최근 사다 남편 쓰다 좋다 쓴다 가져가다 새롭다 건성 추하다 저번 사다 통통하다 들어가다 잇다 늘다 길쭉하다 용기 가바 끼다 바뀌다 기능 스킨 느낌 건성 피부 겨울 스킨 토너 쓰다 얼굴 당기다 잇다 앰플 크림 바르다 인터 미션 스킨 토너 확실하다 묵직하다 느낌 토너 얼굴 바르다 자다 스며들다 보습 충전 로되 좋다 일반 토너 바르다 얼굴 당기다 스미다 들고나다 바르다 크림 바르다 잇다 순하다 거사 용하다 트러블 일어 난적 보습 충전 좋다 계속 재다 저녁 바르다 담날 피부 해보다 좋다 푸석하다 보이다 건성 좋다 로션 합치다 느낌 끄다 자다 용하다 묵직하다 보습 좀더 운철 써다 당분간 스킨 쓸다 피부 타입 건성 민감 순하다 보습 자다 스킨 찾다 인스타 사다 처음 들다 브랜드 긴가민가하다 좋다 스킨 중간 유명하다 히알루론산 써다 자다 모르다 제품 레이어 피부 진정 보습 빵빵 느낌 나다 써다 야하다 좋다 가족 자극 좋다 인생 가족 사용 에센스 좋다 니당다 자극 전혀 건성 건조하다 올라오다 부지 타입 기초 잘못 쓰다 답답하다 트러블 올라오다 인터 미션 레스트업 스킨 진짜 자다 맞다 엄마 보내다 드림 일반 토너 살짝 점도 느낌 바르다 순간 촉촉하다 감다 적임 흡수 빨르다 여러 레이어 무겁다 아침 저녁 사용 좋다 건조 잡다 느낌 좋다 세안 당기다 줄다 피부 매끈하다 느낌 겉도 보습 채우다 느낌 부지 자다 맞다 민감하다 써다 자극 화장 써다 밀림 만족하다 화장 적다 스킨 쓰다 피부 진정 느낌 자주 가요 보습 싫다 건성 부지 건조 심하다 피부 순하다 촉촉하다 토너 찾다 추천
[단독컬러] 무지개맨션 오브제 리퀴드 틴트,"간만에 틴트 색감 성공했습니다👍🏻 안에서 찍었을때 밖에서 찍었을때 굿👍🏻 매장에 재고 있는거 확인 하고 가서 구매했어용 여기 매트립 맛집인거 이제 알아버린 내가 밉다
내가 사랑하는 촉촉보송립… S2 각질부각 절대업뜸

거기다 색은 또 얼마나 이쁜지 케이스도 유니크하게 이쁘고
뭔가 꽃잎 향 나요 향기로와
번창하십시오. 지속력 짧고 안예쁘게 지워져요 ㅠㅠ 색은 예쁜데 입술에 올리면 핑크기가 꽤 강해용 ㅎㅎ 요거 발레 컬러 산건데 왜 베얼리로 뜰까요? 리뉴얼 전에도 두개 사서 잘 썼고 리뉴얼 후에도 모카컬러 샀는데 보들보들 너무 밀착 잘 되고 컬러도 예쁘길래 발레도 구매했는데요

컬러는 너무 예쁜데 요 컬러만 유독 미끌하고 밀착이 안되는 느낌 ㅜㅜ 명도가 밝아서 그런건지 .. 이런 컬러들이 좀 그런 경향성이 있긴 하다만 얘는 밀착도 아쉽고 좀 그래요.....ㅜㅜ 그치만 컬러는 뽀얗고 예쁜 핑크로즈 컬러라 예쁩니다 베이스로 쓰기 좋아요 그치만 위에 글로우 얹으면 다 녹구 .. 무조건 매트랑만 같이 써줘야함 연한립이 별로 잘안어울리는데 이건 연해도 자연스럽게 어우러져요 꽤 착색이 되어좋구요. 채도있는 쿨핑크로보이는데 핑크도 어느정도 잘받는 웜에게도 잘어울려요 감사합니다 만족합니다감사합니다 만족합니다감사합니다 만족합니다",간만 틴트 색감 성공하다 찍다 찍다 매장 재고 확인 가다 구매 매트 맛집 버리다 밉다 사랑 촉촉보송립 각질 부각 대업 거기 이쁘다 케이스 유니크 이쁘다 꽃잎 향기롭다 번창 지속 짧다 예쁘다 지워지다 예쁘다 입술 올리다 핑크 강하다 발레 컬러 사다 얼리다 뜨다 리뉴얼 사서 자다 써다 리뉴얼 모카 컬러 사다 밀착 자다 컬러 예쁘다 발레 구매 컬러 예쁘다 컬러 유독 밉다 밀착 안되다 느낌 명도 밝다 이렇다 컬러 경향 밀착 아쉽다 그치다 컬러 뽀얗다 예쁘다 핑크 컬러 예쁘다 베이스 쓰기 좋다 그치다 로우 얹다 녹다 무조건 매트 써주다 야하다 별로 어울리다 이건 연하다 자연 어우러지다 착색 되어다 좋다 채다 핑크 보이다 핑크 정도 받다 어울리다 감사하다 만족하다 감사하다 만족하다 감사하다 만족하다
[단독특가/블러시증정기획] 비디비치 블랙 퍼펙션 커버 핏 쿠션 기획,"이게 무슨 건성도 쓸 수 있는 세미매트 쿠션임???🤬 ☠️

색상, 지속력 등등 다 떠나서 피부 얇은 사람한테 무조건 비추.
피부 수정화장 밥 먹고나서 입가 제외 아예 안하고 기본 피부결도 좋아서 피부 좋다는 말 매일 듣는 사람인데 이 쿠션은 진짜 팔자랑 입가쪽 잔주름 부각이 미쳤음. 존재하는지도 몰랐던 미세주름 하나하나 다 갈라지고 갈라진 사이에 하얗게 낌.
그 부분 제외하고 나머지 지속력은 나쁘지 않았음. 근데 그게 너무 치명적으로 최악이라 두 번 쓰고 남 줌. 피부 두꺼운 쌉지성피부 친구는 수정용으로 잘 씀. 하나도 안갈라지더라..
비디비치는 기름이 전체적으로 올라오는 피부타입한테 추천.

수부지(거의 건성기반에 T존만 약간 지성)피부 얇고 팔자랑 입가 잔주름 등 평소 주름 사이에 끼는 거 고민인 분들은 진짜 진지하게 비추임. 최근 들어서 쓴 쿠션 중 제일 맘에 안들었음.

기존에 잘 쓰던 정샘ㅁㅜㄹ 스킨누더 보다도 비쌌는데 배신감 미쳤음. 최애 바닐라코 듀부스트 세럼도 바르고 썼는데도 뜸;;
바코 화이트쿠션, 네이ㅁㅣㅇ 매트핏(현재단종) 쓸 때도 이런 갈라짐은 겪어본 적 없음. 이거 바른 날 자신감 개하락했음.

현재 ㅍㅟ 올데쿠 쓰는데 훨 좋음. 발림성, 밀착력, 지속력, 모공커버, 피부표현, 색상 비슷한 것 같아도 압도적으로 더 좋음.
물론 올데쿠도 팔자 살짝 갈라지지만 키스할 정도로 가까이서 보는 거 아니면 티 안나는데 얘는 진심 가뭄수준으로 갈라짐.
스킨누더로 입 주변 수정하는데 올데쿠랑 궁합ok. 비디비치는 노ok. 끼임소생불가(비디비치로 하면 더 소생불가).
내가 화장 못해서 뜨는 거 아님. 양조절 못 하는 거 아님.
본인 뷰티매장에서 근무함. 매일 베이스 정보 따이는 사람임.
올데쿠는 건성이 쓸 수 있는 세미매트 인정. 얘는 쌉노인정. 와 진짜 다들 좋다좋다해서 혹해서 샀는데 인생쿠션 됨..

🤍 색상은 진짜 이쁜 상아색이라 밝은 피부표현 좋아하시는 분들은 충분히 만족할만한 색!
어ㅂ웃ㅌ 쿠션 쿨 21 파데 웜 21 있는데 해당 컬러보다 많이 밝아요!

🤍제형은 진짜하나도 안건조한 세미매트! 새틴한 피부 표현되는 정도의 매트라 피부 너무너무 편한하고 좋아요
가장 큰 장점이라고 느낀게 얇게 발려서 뜬적도 아직 한번도 없고 너무 좋슴당 ㅎㅎ

🤍 커버력이 강력하다!는 아니지만 얇은데도 톤정리, 작은 잡티는 다 가려져서 저는 딱 좋았어요! 팟 컨실러로 다크랑 진한 트러블만 가려주면 빠르게 피부화장은 끝이에요

🤍 지속력이 진짜x9999 좋다고 느꼈는데 마지막 사진이 1월에 낮부터 스키타기 시작해서 밤에 찍은 사진인데, 여전히 잘 유지되어있고 뜨지도 유분에 너무 녹지도 않았어요! 저날부터 이쿠션에 무한신뢰감 생김

🤍 어ㅂ웃ㅌ, 헤ㄹ 블쿠, 아ㄴ아 결쿠션 정도가 제가 손 잘가는 쿠션이었는데 비디비치가 제일 좋았고 어떤 느낌이냐면 두꼐와 결은 아ㄴ아 처럼되는데 촉촉함은 결쿠션보단 적고 블쿠나 어ㅂ웃톤 쿠션보단 더 촉촉했구요! 뭐 여러모로 저 쿠션들 장점만 끌어온? 쿠션으로 느껴져서 이걸로 정착할듯 합니당

도움이 되셨다면 도움이 돼요 부탁드려용 ☺️
(1-실내 / 2- 자연광 / 3-바르고 스키&기차타고 9시간쯤 후) 피부에 각질 없을때 피부 표현 만큼은 진짜 최강입니다
솔직히 각질 부각 생각하면 별점 깎아야하는게 맞긴 한데 각질 관리 잘해주고 바르면 이것만큼 예쁘게 발리는게 또 없더라구요
커버도 잘되고 모공도 잘 메워주고 컬러도 적당한 밝기로 딱 맘에 듭니다
처음에 피부에 쌓을때부터 굉장히 얇게 올라가는데 또 올리면 올릴수록 커버가 쌓여요
근데 신기한건 이렇게 커버를 쌓아줘도 결과물 보면 피부화장이 두껍다는 느낌이 안듭니다
지속력도 좋고 다크닝도 없었어요
가격값 하는 쿠션 ㅇㅈ입니다 ✔️유튜브나 SNS에서 비디비치 추천하는 글이 자주 올라오길래 궁금하기도 하고 해서 구매해봤어요! 우선 본론만 말하면 저는 대만족입니다! 바이럴도 아니고 광고도 아닌데요 저는 커버력 높은 쿠션을 지굼까지 안 써봤구나를 이 쿠션 쓰고서 알았어요... 저의 안경 자국도 잘 커버하고 여드름 자국도 커버하고 촤고다!!
✔️ 우선 저는 색상때문에 고민이 많았는데 결국 21n으로 정착했어요! 저는 기존에 좀 화사하게 바르는거 좋아하는데 이번에는 제 피부색에 맞는걸 써볼까해서 23으로 샀는데 저한테는 색상 자체개 너무 진해서 안색이 안 좋아보였어요...
✔️그래서 21호 샀는데 잘 맞더라고요! 기존 다른 제품 대비 차분하게 나온 편인 것 같아요!
✔️무너질 때도 은근한 윤광이 돌면서 피부도 좋아보이고 저는 계속 쓸 것 같아요! 비디비치 브랜드 자체에 관심도 없었는데 요즘 쿠션이 은근히 후기도 자주 보이고 주변에서도 괜찮다고 하길래 속는셈치고 한 번 구매해보았습니다.. (사실 그러기에 저렴한 가격은 아니었지만..)

최근에 퓌 올데쿠도 구매했고, 기존에 제일 자주+잘 쓰던 인생 쿠션이 헤라 블쿠라 어쩌다보니 블랙쿠션 수집가가 되었어요..

아무튼 비디비치 쿠션 제형은 쫀쫀하면서 얇게 밀착 잘 되는 제형이고요. 처음에 얼굴에 바르기전에 손바닥에 바르자마자 주름 메꿔지고 매끈해져서 놀랐어요. 그리고 바르자마자 막 광 나는 타입 아니고 세미매트 제형입니다. 밝은 21호 기준 컬러는 19NC 딱 좋았고요. 헤라 블쿠 17N 사용하는데 컬러 비슷해요. 퓌 올데쿠 19호가 더 밝구요..

지속력도 괜찮았는데 하루종일 야외에 나가있던 날 개시했고, 일부러 수정 화장 한번도 안하고 10시간 후에 코 주변에만 유분있고 다른 부분 거의 다 멀쩡했어요. 보통 이런 매트 쿠션 사용하면 복합성이라 그런가 입 주변이 건조해서 그런지 좀 뜨고 뭉치는데 그런게 전혀 없어서 만족이었어요!

커버력도 괜찮은 편인데 하나 아쉬운게 있다면 모공 커버는 엄청 잘되진 않아요. 근데 이건 뭐 프라이머 바르거나 하면 되니까 크게 불편한 부분은 아니었슴미다. 역시 베이스 제품은 가격값 하는거같아요.. 최근에 화제였던 퓌 보단 더 좋았습니당 수부지인 저한테 조아요! 처음엔 매트하게 픽싱되면서 유분기도 적게 올라와요 그래서 수정화장하기도 좋습니당 >___< 같이 준 블러셔도 쪼꼬미 귀여워요",건성 쓸다 세미 매트 쿠션 색상 지속 떠나다 피부 얇다 무조건 비추다 피부 수정 화장 먹다 입가 제외 아예 기본 피부 좋다 피부 좋다 매일 듣다 쿠션 진짜 팔자 입가 주름 부각 존재 모르다 미세 주름 갈라지다 갈라지다 사이 하얗다 부분 제외 나머지 지속 나쁘다 치명 최악 쓰다 피부 두껍다 싸다 지성 피부 친구 수정 자다 쓰다 갈라지다 비다 비치다 기름 전체 올라오다 피부 타입 추천 부지 건성 기반 지성 피부 얇다 팔자 입가 주름 평소 주름 사이 끼다 고민 진짜 진지하다 비추다 최근 들어서다 쓸다 쿠션 제일 들다 기존 자다 쓰다 정샘 스킨 누더 비싸다 배신 최애 바닐라코 부스트 바르다 써다 바코 화이트 쿠션 매트 현재 단종 쓸다 이렇다 갈라지다 겪다 바르다 자신감 하락 현재 데쿠 쓰다 좋다 발림 밀착 지속 모공 커버 피부 표현 색상 압도 좋다 데쿠 팔자 살짝 갈라지다 키스 정도 가까이 알다 진심 가뭄 수준 갈라지다 스킨 누더 주변 수정 데쿠 궁합 비다 비치다 끼임 불가 비다 비치 불가 화장 뜨다 조절 본인 뷰티 매장 근무 매일 베이스 정보 따다 데쿠 건성 쓸다 세미 매트 인정 싸다 인정 오다 진짜 들다 좋다 좋다 다해 사다 인생 쿠션 색상 진짜 이쁘다 상아색 밝다 피부 표현 좋아하다 충분하다 만족하다 쿠션 파다 해당 컬러 밝다 진짜 건조하다 세미 매트 새틴 피부 표현 정도 매트 피부 편하다 좋다 크다 장점 느끼다 얇다 발리다 뜨다 적도 좋슴당 커버 강력하다 늘다 얇다 정리 작다 잡티 가려지다 좋다 컨실러 다크 진하다 트러블 가다 빠르다 피부 화장 지속 진짜 좋다 느끼다 마지막 사진 스키 시작 찍다 사진 여전하다 자다 유지 되어다 뜨다 녹지 쿠션 무한 신뢰 생기다 블쿠 쿠션 정도 가다 쿠션 비다 비치 제일 좋다 어떻다 느낌 두다 촉촉하다 쿠션 적다 블쿠 웃톤 쿠션 촉촉하다 모로 쿠션 장점 끌다 쿠션 느껴지다 정착 도움 도움 돼다 부탁드리다 실내 자연 바르다 스키 기차 타고 피부 각질 피부 표현 진짜 최강 솔직하다 각질 부각 깎다 맞다 각질 관리 잘해주다 바르다 예쁘다 발리다 커버 모공 자다 메우다 컬러 적당하다 밝기 듭니 처음 피부 쌓다 굉장하다 얇다 올라가다 올리다 올리다 커버 쌓이다 신기하다 커버 쌓다 결과물 피부 화장 두껍다 느낌 안듭니 지속 좋다 다크닝 가격 쿠션 유튜브 비다 비치 추천 자주 올라오다 궁금하다 구매 해봤다 본론 만족 바이럴 광고 커버 높다 쿠션 지굼 써다 구나 쿠션 쓰다 알다 안경 자국 자다 커버 여드름 자국 커버 촤고 색상 고민 많다 정착 기존 화사하다 바르다 좋아하다 피부색 맞다 써다 사다 색상 자체 진하다 안색 좋다 보이다 사다 자다 맞다 기존 제품 대비 차분하다 나오다 무너지다 은근 윤광 돌다 피부 좋다 아보 계속 쓸다 비다 비치 브랜드 자체 관심 쿠션 은근 후기 자주 보이 주변 괜찮다 늘다 구매 해보다 저렴하다 가격 최근 데쿠 구매 기존 제일 자주 자다 쓰다 인생 쿠션 헤라 블쿠 블랙 쿠션 수집가 되어다 비다 비치 쿠션 쫀쫀 얇다 밀착 자다 고요 처음 얼굴 바르다 기전 손바닥 바르다 주름 꾸다 매끈하다 바르다 타입 세미 매트 밝다 기준 컬러 좋다 헤라 블쿠 사용 컬러 데쿠 호가 밝다 지속 괜찮다 하루 종일 야외 나가다 개시 일부러 수정 화장 주변 부분 멀쩡하다 보통 이렇다 매트 쿠션 사용 복합 런가 주변 건조하다 뜨다 뭉치다 전혀 만족 커버 괜찮다 아쉽다 모공 커버 이건 프라이머 바르다 크게 불편하다 부분 밉다 베이스 제품 가격 최근 화제 좋다 니당다 부지 좋다 처음 매트 픽싱되면 분기도 적다 올라오다 수정 장하다 좋다 니당다 블러셔 쪼꼬미 귀엽다
